domena,naslov,opis,link
euronews.com,Balkans rocked as leaked memo explores redrawing Bosnia's ...,"Apr 20, 2021 ... There is no other recourse. And once Janša takes over the EU Presidency, he  will put this on the agenda, non-paper or not,"" concluded Botteri.",https://www.euronews.com/2021/04/19/balkans-rocked-as-leaked-memo-explores-redrawing-bosnia-s-borders-along-ethnic-lines
total-slovenia-news.com,Janša Denies Promoting Break-Up of Bosnia Along Ethnic Lines as ...,"Apr 19, 2021 ... Updated 18:20STA, 19 April 2021 - Prime Minister Janez Janša has ... Current  borders (left), borders proposed in the non-paper (right Left: ...",https://www.total-slovenia-news.com/politics/8142-jansa-denies-promoting-break-up-of-bosnia-along-ethnic-lines-as-islamist-group-protests-in-sarajevo
euobserver.com,US rejects Slovenia-linked plan to break up Bosnia,"Apr 16, 2021 ... Slovenian prime minister Janez Janša (l) and EU Council president ... not further  comment the topic on the so-called 'non-paper' document ...",https://euobserver.com/world/151572
total-croatia-news.com,Milanović Blasts Alleged Non-Paper on Changing The Balkan Borders,"Apr 17, 2021 ... Slovenian Prime Minister Janez Janša denied sending Brussels any non-paper  on that. Media close to him say such accusations are an ...",https://www.total-croatia-news.com/news/52225-balkan-borders
total-slovenia-news.com,Slovenian Website Releases Non-Paper Proposing Changes to W ...,"Apr 15, 2021 ... Speculation about the non-paper was prompted earlier this week as the Bosnian  portal politicki.ba alleged that Slovenian Prime Minister Janša ...",https://www.total-slovenia-news.com/politics/8124-slovenian-website-releases-non-paper-proposing-changes-to-w-balkan-borders
sta.si,Ambassador in Bosnia summoned over alleged non paper on ... - STA,"Apr 12, 2021 ... Politicki.ba said that Janša had handed the non paper to European Council  President Charles Michel in late February or early March and that "" ...",https://english.sta.si/2889234/ambassador-in-bosnia-summoned-over-alleged-non-paper-on-western-balkans
aljazeera.com,Disputed memo on partitioning Bosnia sparks fears of violence ...,"Apr 22, 2021 ... Slovenian and Bosnian press have reported that Slovenian Prime Minister Janez  Jansa (left) allegedly helped distribute a non-paper within the ...",https://www.aljazeera.com/news/2021/4/22/leaked-memo-on-partition-of-bosnia-could-spark-violence
emerging-europe.com,Are Bosnia and Herzegovina's borders back on the international ...,"Apr 14, 2021 ... Mr Janša meanwhile denied sending the “non-paper” in a statement posted on  Twitter. Mr Pahor's office added that the president wants “the ...",https://emerging-europe.com/news/are-bosnia-and-herzegovinas-borders-back-on-the-international-agenda/
reuters.com,Unofficial EU note on redrawing Balkan borders causes angst in ...,"Apr 16, 2021 ... But Jansa denied that he had sent the document and accused ""fake ... told  Reuters that EU member states have not discussed the paper.",https://www.reuters.com/world/europe/unofficial-eu-note-redrawing-balkan-borders-causes-angst-bosnia-2021-04-16/
dw.com,Non-paper: Bošnjaci protiv ″muslimanske državice″ u Evropi ...,"20 tra 2021 ... ""I nikakva Gaza, kalifat ili bošnjačko-muslimanska državica u Evropi, što nam  famoznim non-paperom nude slovenski premijer Janez Janša i ...",https://www.dw.com/bs/non-paper-bo%C5%A1njaci-protiv-muslimanske-dr%C5%BEavice-u-evropi/a-57259555
betabriefing.com,"Jansa's Non-Paper: Dissolution of Bosnia, Creation of Greater ...","Jansa's Non-Paper: Dissolution of Bosnia, Creation of Greater Serbia and  Greater Albania. Source: Beta. News / Politics | 15.04.21 | access_time 17:11.  info",https://betabriefing.com/news/politics/14642-jansas-non-paper-dissolution-of-bosnia-creation-of-greater-serbia-and-greater-albania
novinite.com,HOT NEWS: Mysterious Non-Paper Mulling Border Changes in ...,"Apr 16, 2021 ... Janša has denied writing the document and his office, contacted by EURACTIV,  said it “does not further comment” on the issue. Bosnian media ...",https://www.novinite.com/articles/208985/HOT+NEWS%3A+Mysterious+Non-Paper+Mulling+Border+Changes+in+Western+Balkans+Creates+Storm+in+Brussels
fena.news,Janša denies that there is non-paper that can be linked to the ...,"Apr 16, 2021 ... Janša denies that there is non-paper that can be linked to the Government of.  SARAJEVO, April 16 (FENA) – Slovenian Prime Minister Janez ...",https://www.fena.news/bih/jansa-denies-that-there-is-non-paper-that-can-be-linked-to-the-government-of-slovenia/
balkaneu.com,Dimitrov calls unfounded speculations around Slovenian non-paper ...,"Apr 14, 2021 ... ... was a non-paper. We have to watch what the officials say on camera, what the  officials and the Prime Minister of Slovenia Janez Jansa state,” ...",https://balkaneu.com/dimitrov-calls-unfounded-speculations-around-existence-of-slovenian-non-paper-irresponsible/
slobodnaevropa.org,Janez Janša odbija da se izjasni o 'non-paper' dokumentu za ...,"15 апр 2021 ... Janez Janša odbija da se izjasni o 'non-paper' dokumentu za Zapadni Balkan ...  Janez Janša (drugi s leva), premijer Slovenije, sa evropskim ...",https://www.slobodnaevropa.org/a/slovenija-janez-jansa-zapadni-balkan-non-paper/31205572.html
tanjug.rs,Vucic denies having anything to do with alleged non ... - TANJUG,"Apr 20, 2021 ... “Do you really think Jansa can be told what to do? I have not seen the non-paper, ” Vucic said, adding that what he had read about the ...",http://www.tanjug.rs/full-view_en.aspx?izb=647515
youtube.com,"Janša demantovao da je u brisel slao ""non paper"" 12. 04. 2021 ...","12 апр 2021 ... Janša demantovao da je u brisel slao ""non paper"" 12. 04. 2021. 631 views631  views. • Apr 12, 2021. 0. 1. Share. Save. 0 / 1. tvk3. tvk3.",https://www.youtube.com/watch?v=ZFnuaucWoXw
mladina.si,Janša Džaferoviću: »Slovenski non-paper o mejah ne obstaja ...,"17 apr 2021 ... Bošnjaški član predsedstva BiH Šefik Džaferović se je včeraj po telefonu  pogovarjal s slovenskim premierjem Janezom Janšo, potem ko ga je ...",https://www.mladina.si/206719/jansa-dzaferovicu-slovenski-non-paper-o-mejah-ne-obstaja/
b92.net,"""Non-paper"" shook the region: New borders in the Balkans ...","Apr 16, 2021 ... ... to Serbia and the unification of Kosovo with Albania, and speculates that  Slovenian President Janez Jansa sent the ""non-paper"" to Brussels.",https://www.b92.net/eng/news/politics.php?yyyy=2021&mm=04&dd=16&nav_id=110644
rtvslo.si,Janša klical v BiH: Slovenski non-paper o mejah ne obstaja ...,"16 apr 2021 ... ... in spremembi meja odločno nasprotujem,"" je poudaril predsednik Pahor.  Premier Janša je BiH obvestil, da slovenski non-paper o mejah ne ...",https://www.rtvslo.si/slovenija/jansa-klical-v-bih-slovenski-non-paper-o-mejah-ne-obstaja/576970
sarajevotimes.com,"Slovenian Media published ""Non-Paper"": Plan for Dissolution of BiH ...","Apr 16, 2021 ... As of Monday, there has been speculation in Slovenia, Croatia, and BiH about  whether Prime Minister Janez Jansa has indeed sent an unofficial ...",http://www.sarajevotimes.com/slovenian-media-published-non-paper-plan-for-dissolution-of-bih/
aldeparty.eu,Liberals united in condemnation for Non-paper on Western Balkans ...,"Apr 21, 2021 ... He also called on Slovenia's Prime Minister Janez Janša – whose country  assumes the rotating Presidency of the Council of the European Union ...",https://www.aldeparty.eu/liberals_united_in_condemnation_for_non_paper_on_western_balkans
slobodenpecat.mk,"EC: The story of Jansa's ""non-paper"" is made up - Free Press","Apr 13, 2021 ... Regional media reported yesterday that Prime Minister Jansa handed over a "" non-paper"" to Michel outlining a strategy to ""finalize the break-up ...",https://www.slobodenpecat.mk/en/ek-prikaznata-za-non-pejperot-na-jansha-e-izmislena/
ips-journal.eu,The Balkans' demons of ethno-nationalism – European integration ...,1 day ago ... A recently leaked 'non-paper' envisions new borders along ethnic ... Slovenian  Prime Minister Janez Jansa and Hungarian Prime Minister ...,https://www.ips-journal.eu/topics/european-integration/the-balkans-demons-of-ethno-nationalism-5144/
republika.mk,"Mickoski: I spoke with Jansa, there is no ""Slovenian non-paper ...","Apr 15, 2021 ... Mickoski: I spoke with Jansa, there is no “Slovenian non-paper”. VMRO-DPMNE  President Hristijan Mickoski said that he spoke with Slovenian ...",https://english.republika.mk/news/macedonia/mickoski-i-spoke-with-jansa-there-is-no-slovenian-non-paper/
aljazeera.net,Janša razgovarao s Džaferovićem i demantirao da postoji non-paper,"16 апр 2021 ... Slovenski premijer je rekao da Slovenija podržava suverenitet i teritorijalni  integritet Bosne i Hercegovine, kao i njen euroatlantski put.",https://balkans.aljazeera.net/news/balkan/2021/4/16/jansa-razgovarao-s-dzaferovicem-demantirao-da-postoji-non-paper
vecer.com,"Janša poklical Džaferovića in mu povedal, da slovenski non-paper ...","16 apr 2021 ... Ne obstaja non paper, ki bi ga bilo mogoče povezati s slovensko vlado in bi  vseboval spremembe meja ali spodkopavanje ozemeljske ...",https://www.vecer.com/slovenija/predsedstvo-bih-jansa-poklical-dzaferovica-in-mu-povedal-da-slovenski-non-paper-ne-obstaja-10240521
euractiv.it,"Slovenia, il caso del non paper sulla “dissoluzione pacifica” della ...","14 apr 2021 ... Slovenia, il caso del non paper sulla “dissoluzione pacifica” della ... un  documento non ufficiale, “che il primo ministro sloveno Janez Janša ...",https://euractiv.it/section/mondo/news/slovenia-il-caso-del-no-paper-sulla-dissoluzione-pacifica-della-bosnia-erzegovina/
europeanmovement.eu,ALDE: Liberals united in condemnation for Non-paper on Western ...,"Apr 22, 2021 ... He also called on Slovenia's Prime Minister Janez Janša – whose country  assumes the rotating Presidency of the Council of the European Union ...",https://europeanmovement.eu/news/liberals-united-in-condemnation-for-non-paper-on-western-balkans/
neweurope.eu,Slovenia provokes with non-paper supporting Balkan partitions ...,"18 hours ago ... The true source of the document may well remain a mystery, but regional media  last week attributed the paper to Janez Jansa, Prime Minister of ...",https://www.neweurope.eu/article/slovenia-provokes-with-non-paper-supporting-balkan-partitions/
jutarnji.hr,Jutarnji list - 'Navodni Janšin non-paper o BiH sam vidio na portalu ...,"16 tra 2021 ... ... navodni non-paper slovenskog premijera Janeza Janše o BiH vidio ...  Slovenski premijer Janez Janša u utorak je, demantirajući da je autor i ...",https://www.jutarnji.hr/vijesti/hrvatska/navodni-jansin-non-paper-o-bih-sam-vidio-na-portalu-hrvatska-ga-nije-dobila-15065912
montenegrointernational.org,"Jansa leads the EU countries that want a ""Greater Serbia"" and the ...","Apr 13, 2021 ... The Prime Minister of Slovenia handed over a “non-paper” to the President of the  European Council, Charles Michel, where he announced that ...",https://montenegrointernational.org/jansa-leads-the-eu-countries-that-want-a-greater-serbia-and-the-dismemberment-of-bosnia-and-herzegovina-montenegro-and-northern-macedonia/
hullcitytigers.com,"Janša nazvao Džaferovića: Ne postoji ""non paper"" o prekrajanju ...","16 апр 2021 ... Janša nazvao Džaferovića: Ne postoji ""non paper"" o prekrajanju granica,  podržavam integritet BiH. pA, g9, KT, Rr, qU, wy, TF, GI, Xx, uE, G9, yh ...",https://hullcitytigers.com/p/bih/comments/ms5nee/jan%C5%A1a_nazvao_d%C5%BEaferovi%C4%87a_ne_postoji_non_paper_o/
klix.ba,"Janša nazvao Džaferovića: Ne postoji ""non paper"" o prekrajanju ...","16 tra 2021 ... ... na poziv premijera Republike Slovenije Janeza Janše, koji je obavijestio člana  Predsjedništva BiH Džaferovića da ne postoji ""non paper"" koji ...",https://www.klix.ba/vijesti/bih/jansa-nazvao-dzaferovica-ne-postoji-non-paper-o-prekrajanju-granica-podrzavam-integritet-bih/210416131
trtworld.com,The neglected dangers of the far-right network in the Balkans,"Apr 22, 2021 ... Slovenia, led by Janez Jansa, a far-right politician, with strong ties to ... The  timing of the non-paper is especially concerning since Slovenia will ...",https://www.trtworld.com/opinion/the-neglected-dangers-of-the-far-right-network-in-the-balkans-46063
24ur.com,"Janša obvestil Džaferovića, da slovenski non-paper o mejah ne ...","Janša obvestil Džaferovića, da slovenski non-paper o mejah ne obstaja.  Sarajevo / Ljubljana, 16.04.2021, 10:05 | Posodobljeno pred 12 dnevi.  PREDVIDEN ...",https://www.24ur.com/novice/slovenija/jansa-obvestil-dzaferovica-da-slovenski-non-paper-o-mejah-ne-obstaja.html
courrierdesbalkans.fr,Slovénie : le non-paper met le gouvernement Janša dans l'embarras ...,21 avr. 2021 ... Changer les frontières des Balkans : un « non paper » qui bouleverse la région  Slovénie : Janša fait bloc avec la Hongrie.,https://www.courrierdesbalkans.fr/Le-non-paper-met-la-Slovenie-dans-l-embarras
mia.mk,Balkan Liberals on alleged non-paper: COVID-19 crisis in the region ...,"Apr 17, 2021 ... Balkan Liberals on alleged non-paper: COVID-19 crisis in the region ...  circulating with the alleged non-paper by Slovenian PM Janez Janša ...",https://mia.mk/balkan-liberals-on-alleged-non-paper-covid-19-crisis-in-the-region-and-eu-a-fertile-ground-for-dangerous-nationalist-ideas-of-redrawing-borders/?lang=en
new-perspektiva.com,Janez Janša odbija da se izjasni o 'non-paper' dokumentu za ...,16 апр 2021 ... “Kabinet premijera Republike Slovenije do daljnjeg neće komentarisati temu o  takozvanom non-paper dokumentu o Zapadnom Balkanu“.,https://www.new-perspektiva.com/sr/janez-jansa-odbija-da-se-izjasni-o-non-paper-dokumentu-za-zapadni-balkan/
telegram.hr,Janša tvrdi kako ne postoji famozni non-paper kojim bi Slovenija ...,16 tra 2021 ... Janša tvrdi kako ne postoji famozni non-paper kojim bi Slovenija zagovarala  promjene granica na Balkanu. Janša je tijekom dana nazvao ...,https://www.telegram.hr/politika-kriminal/jansa-tvrdi-kako-ne-postoji-famozni-non-paper-kojim-bi-slovenija-zagovarala-promjene-granica-na-balkanu/
rainews.it,Janša Džaferoviću: non-paper o BiH ne obstaja! - Politika in ...,18 apr 2021 ... Janša Džaferoviću: non-paper o BiH ne obstaja! Sogovornika po telefonu tudi o  slovenskem predsedovanju Svetu EU in o načrtovanju vrha EU ...,https://www.rainews.it/tgr/fjk/articoli/2021/04/tdd-Jansa-Dzaferovicu-non-paper-o-BiH-ne-obstaja-7046746f-c06d-430a-9f1d-91d673676355.html
sarajevotimes.com,"Slovenian PM: There is no ""Non Paper” that would include ...","Apr 17, 2021 ... Dzaferovic spoke by phone with Jansa, who told him that Slovenia supports the  sovereignty and territorial integrity of Bosnia and Herzegovina, as ...",https://www.sarajevotimes.com/slovenian-pm-there-is-no-non-paper-that-would-include-redrawing-bih-borders/
necenzurirano.si,"Objavljamo dokument o razdelitvi BiH, ki ga išče ... - Necenzurirano.si","15 apr 2021 ... ... in Hercegovini vrstijo ugibanja, ali je predsednik vlade Janez Janša v Bruselj  res poslal neuradni diplomatski dokument (""non-paper"" v angl.) ...",https://necenzurirano.si/clanek/aktualno/objavljamo-slovenski-dokument-o-razdelitvi-bih-ki-ga-isce-ves-balkan-865692
gov.si,Prime Minister Janez Janša on TV Slovenija: My letter to the ...,"Nov 20, 2020 ... Prime Minister Janša was a guest on the programme A Talk with the Prime ... He  pointed out that the current situation does not surprise him as it was ... the fact  that a historical document, i.e. the budget for 2021 and 2022, was ...",https://www.gov.si/en/news/2020-11-20-prime-minister-janez-jansa-on-tv-slovenija-my-letter-to-the-european-leaders-was-a-letter-calling-for-a-solution-and-not-a-letter-in-which-i-would-take-anyones-side/
gov.si,Letter-of-PM-Janez-Jansa-to-the-PEUCO-Charles-Michel.pdf,"Nov 17, 2020 ... The convoy began to form so as not to repeat the tragedies and shipwrecks of the  20th century on the European continent. These have caused ...",https://www.gov.si/assets/PV/November-2020/Letter-of-PM-Janez-Jansa-to-the-PEUCO-Charles-Michel.pdf
index.hr,Janša demantira non-paper: Taj dokument ne postoji - Index.hr,"16 tra 2021 ... NE postoji nikakav dokument, pa ni non-paper, kojim bi Slovenija zagovarala  promjene granica na Balkanu, poruka je koju je danas slovenski ...",https://www.index.hr/vijesti/clanak/jansa-demantira-nonpaper-taj-dokument-ne-postoji/2269376.aspx
euractiv.de,Will Slowenien die „friedliche Auflösung“ Bosnien-Herzegowinas ...,13. Apr. 2021 ... und Premier Janez Janša (Archivbild aus dem Jahr 2018). ... Janša habe EU- Ratspräsident Charles Michel ein Non-Paper mit den Prioritäten ...,https://www.euractiv.de/section/eu-aussenpolitik/news/slovenia-suspected-of-seeking-peaceful-dissolution-of-bosnia-herzegovina/
sta.si,"Janša v telefonskem pogovoru obvestil Džaferovića, da ... - STA","16 apr 2021 ... Janša v telefonskem pogovoru obvestil Džaferovića, da slovenski non-paper o  mejah ne obstaja. Sarajevo/Ljubljana, 16. aprila - Bošnjaški član ...",https://www.sta.si/2891043/jansa-v-telefonskem-pogovoru-obvestil-dzaferovica-da-slovenski-non-paper-o-mejah-ne-obstaja
insajder.com,"Kako ga je Rama pokazal Janši: »Non-paper«, perfidna albanska ...","18 apr 2021 ... Janez Janša je medtem sporočil članu predsedstva BiH Šefiku Džaferoviću, da » ne obstaja 'non-paper', ki bi ga bilo mogoče povezati s ...",https://insajder.com/slovenija/kako-ga-je-rama-pokazal-jansi-non-paper-perfidna-albanska-past-za-naivneze-iz-slovenije-eu
derstandard.de,Weiteres Non-Paper zum Balkan aufgetaucht - Kosovo ...,"vor 2 Tagen ... Mehrere Non-Papers, die massive Grenzänderungen beinhalten, werden derzeit  diskutiert. Sloweniens Premier Janez Janša wies die ...",https://www.derstandard.de/story/2000126201883/weiteres-non-paper-zum-balkan-aufgetaucht
tportal.hr,Janša: Ne postoji dokument kojim bi Slovenija zagovarala promjene ...,"16 tra 2021 ... Ne postoji nikakav dokument pa ni non-paper kojim bi Slovenija zagovarala  promjene granica na Balkanu, poruka je koju je u petak slovenski ...",https://www.tportal.hr/vijesti/clanak/jansa-ne-postoji-dokument-kojim-bi-slovenija-zagovarala-promjene-granica-20210416
gazetatema.net,"Change of borders idea revived, Slovenian media publishes non ...","Apr 15, 2021 ... Slovenian media Necenzurirano.si has published Thursday a non-paper that  Slovenian Prime Minister Janez Jansa reportedly sent to the EU ...",https://www.gazetatema.net/en/change-of-borders-idea-revived-slovenian-media-publishes-non-paper-on-partition-of-bosnia-kosovo-albania-unification/
nachrichten.at,Non-Paper zu neuen Grenzziehungen im Westbalkan veröffentlicht ...,"16. Apr. 2021 ... LJUBLJANA. Der slowenische Ministerpräsident Janez Jansa soll der  Europäischen Union ein ""Non Paper"" zu neuen Grenzen am Westbalkan ...","https://www.nachrichten.at/politik/aussenpolitik/non-paper-zu-neuen-grenzziehungen-im-westbalkan-veroeffentlicht;art391,3385538"
siol.net,Janša zaradi non-paperja klical v BiH - siol.net,"16 apr 2021 ... ... da ne obstaja tako imenovani non-paper, ki bi ga bilo mogoče povezati s  slovensko vlado in bi vseboval spremembe meja ali spodkopavanje ...",https://siol.net/novice/slovenija/jansa-zaradi-non-paperja-klical-v-bih-550282
novilist.hr,Neobična priča o dokumentu u kojem Janez Janša predlaže podjelu ...,"13 tra 2021 ... BRUXELLES - Europska komisija nije primila i ne zna ni za kakav “non-paper”  koji je, po tvrdnjama nekih dužnosnika u BiH i tamošnjih medija, ...",https://www.novilist.hr/novosti/neobicna-prica-o-dokumentu-u-kojem-janez-jansa-predlaze-podjelu-bih-europsko-vijece-potvrdilo-da-su-ga-primili-a-onda-su-se-predomislili/
rtvslo.si,Janša glede non-paper dokumenta klical v BiH,Janša glede non-paper dokumenta klical v BiH. Odmevi. © MMC RTV Slovenija ( ISSN 1581-372X) | FAQ | Impresum | Mobilni RTV 4D | Spletni piškotki | Prijava ...,https://4d.rtvslo.si/arhiv/odmevi/174769203
vijesti.me,"Janša Džaferoviću: Ne postoji ""non paper"" koji uključuje prekrajanje ...","16 апр 2021 ... Janša Džaferoviću: Ne postoji ""non paper"" koji uključuje prekrajanje granica ili  povredu teritorijalnog integriteta BiH. Janša je kazao da ...",https://www.vijesti.me/svijet/balkan/530781/jansa-dzaferovicu-ne-postoji-non-paper-koji-ukljucuje-prekrajanje-granica-ili-povredu-teritorijalnog-integriteta-bih
eceee.org,4. Monitoring and evaluation for greater impact,"This is a non-peer reviewed extended abstract. No paper available. Tadeja  Janša, Josef Stefan Institute, Energy Efficiency Centre, Slovenia Andreja  Urbančič ...",https://www.eceee.org/library/conference_proceedings/eceee_Summer_Studies/2019/4-monitoring-and-evaluation-for-greater-impact/
ansa.it,"Balcani: Jansa smentisce, nessun documento a Ue su confini ...","Secondo indiscrezioni ha dato a Michel un controverso non-paper. 13 aprile, 15: 04. salta direttamente al contenuto dell'articolo; salta al contenuto correlato ...",https://www.ansa.it/nuova_europa/it/notizie/nazioni/slovenia/2021/04/13/balcani-jansa-smentisce-nessun-documento-a-ue-su-confini_78407b1f-e98b-4328-893a-551f222551af.html
slobodnadalmacija.hr,"Tko je Janez Janša, 'slovenski Trump' koji bi ... - Slobodna Dalmacija","19 tra 2021 ... Jer Janša je dovoljno puta do sada pokazao da je s Orbanom na istoj valnoj  dužini. Potvrda toga duploga pasa je i ovaj non-paper, koji se piše ...",https://slobodnadalmacija.hr/vijesti/regija/tko-je-janez-jansa-slovenski-trump-koji-bi-komadao-bosnu-i-hercegovinu-donosimo-profil-kontroverznog-politicara-1092371
barrons.com,Slovenia President Rejects Alleged Plan To Change Western ...,"Apr 16, 2021 ... ... news website Necenzurirano on Thursday published a ""non-paper"", ... Jansa,  who plans to host a summit on Balkan issues while Slovenia ...",https://www.barrons.com/news/slovenia-president-rejects-alleged-plan-to-change-western-balkans-borders-01618589715
nih.gov,Why the honey badger don't care: Convergent evolution of venom ...,"Jun 1, 2015 ... Danielle H Drabeck , Antony M Dean , Sharon A Jansa ... has evolved in some  venom-resistant mammals to no longer bind these toxins.",https://pubmed.ncbi.nlm.nih.gov/25796346/
aa.com.tr,Slovenian leader rejects change to W. Balkans borders,"Apr 17, 2021 ... Reports claimed that one of the non-paper documents, which ... region, was  recently sent to Brussels by Slovenian Prime Minister Janez Jansa.",https://www.aa.com.tr/en/europe/slovenian-leader-rejects-change-to-w-balkans-borders/2211721
kroativ.at,Janša dementiert Non-Paper zum Neuzeichnen von Grenzen im ...,17. Apr. 2021 ... Die slowenische Investigativplattform „Necenzurirano.si“ veröffentlichte Anfang  der Woche ein Non-Paper (inoffizielles diplomatisches ...,https://kroativ.at/jansa-dementiert-non-paper-zum-neuzeichnen-von-grenzen-im-westbalkan/
civil.today,The “bush” of Janez's “rabbit” - CIVIL Today,"Apr 19, 2021 ... ... about the consequences of “Janez Jansa's non-paper”, which proposes a ...  conservative-populist circles of Orban and Jansa's government.",https://civil.today/the-bush-of-janezs-rabbit/
fokuspokus.si,Resnica kot škart roba: Tako imenovani non-paper ... - Fokuspokus.si,"17 apr 2021 ... Tako imenovani non-paper, nepapir, nedokument — ali po slovensko ... da Janša  — ali še prijazneje rečeno: niti Janša — ni tako nor, da bi šel ...",https://www.fokuspokus.si/resnica-kot-skart-roba-tako-imenovani-non-paper-ali-po-slovensko-krneki-10221790
zurnal24.si,Janša in Pahor danes na naslovnicah bosansko-hercegovskih ...,"12 apr 2021 ... Janša je obstoj t. i. ""non paperja"" zanikal. ... Portal politicki.ba je poročal, da je  Janša omenjeni non paper konec februarja ali v začetku marca ...",https://www.zurnal24.si/svet/jansa-in-pahor-danes-na-naslovnicah-bosansko-hercegovskih-casopisov-365042
reporter.si,"Bošnjaki razburjeni: Janša naj bi vodil države, ki želijo veliko Srbijo ...","12 apr 2021 ... Portal politicki.ba pa je poročal, da je premier Janša EU poslal non paper, v  katerem naj bi kot temo slovenskega predsedovanja Svetu EU ...",https://reporter.si/clanek/svet/bosnjaki-razburjeni-jansa-naj-bi-vodil-drzave-ki-zelijo-veliko-srbijo-864964
gradski.me,JANŠA SE OGLASIO O “NON-PAPERU” I RASPADU BiH – Gradski ...,12 апр 2021 ... Premijer Slovenije Janez Janša oglasio se danas na Twitteru u vezi s navodima  medija da je predao “non-paper” predsjedniku Evropskog ...,https://gradski.me/2021/04/12/jansa-se-oglasio-o-non-paperu-i-raspadu-bih/
oslobodjenje.ba,"Nakon svih dešavanja, Janez Janša nazvao Šefika ... - Oslobođenje","Nakon svih dešavanja, Janez Janša nazvao Šefika Džaferovića: Sporni ""non- paper"" ne postoji. BiH16/04/2021 u 17:46 h. Janša tvrdi da Slovenija poštuje ...",https://www.oslobodjenje.ba/vijesti/bih/nakon-svih-desavanja-janez-jansa-nazvao-sefika-dzaferovica-sporni-non-paper-ne-postoji-648501
slobodna-bosna.ba,"AKO LAŽE JANŠA, NE LAŽE BRUXELLES: Iz kabineta Charlesa ...","13 апр 2021 ... AKO LAŽE JANŠA, NE LAŽE BRUXELLES: Iz kabineta Charlesa Michela  potvrđeno da su primili Janšin ""nepostojeći"" NON-PAPER o Bosni i ...",https://www.slobodna-bosna.ba/vijest/195730/ako_laze_jansa_ne_laze_bruxelles_iz_kabineta_charlesa_michela_potvrdjeno_da_su_primili_jansin_nepostojeci_non_paper_o_bosni_i_hercegovini.html
megafon.si,"Janša v telefonskem pogovoru obvestil Džaferovića, da slovenski ...","Janša v telefonskem pogovoru obvestil Džaferovića, da slovenski non-paper o  mejah ne obstaja. 16.04.2021 19:37Osveženo: 25 minut prej. 1 minuta za branje.",https://megafon.si/slovenija/jansa-v-telefonskem-pogovoru-obvestil-dzaferovica-da-slovenski-non-paper-o-mejah-ne-obstaja/
