domena,naslov,opis,link
opensocietyfoundations.org,"Building Open Society in the Western Balkans, 1991–2011","Oct 4, 2011 ... Reviving Creativity After the War by Dunja Blažević ... going back to the culture of  unaccountability and ... democratic Party, Janez Janša.",https://www.opensocietyfoundations.org/uploads/b52ff050-5ec4-4df7-b078-e02cf5374bd9/open-society-western-balkans-20111004.pdf
ku.edu,Theatrical Nationalism: Exposing the “Obscene Superego” of the ...,"Cultural nationalism flourished particularly in the nineteenth century, ... such as  Christoph Schlingensief in Austria and Janez Janša in Slovenia, who ... Nations  and nation-states are somewhat arbitrary constructions that result from wars,.",https://journals.ku.edu/jdtc/article/download/4366/4094
digicult.it,"Janez Jansa Exhibition • Digicult | Digital Art, Design and Culture","This was designed to satisfy the comprehensible sexual urges of German  soldiers at war, while avoiding the unpleasant health risks connected to  frequenting ...",http://digicult.it/en/news/janez-jansa-exhibition/
state.gov,2020 Country Reports on Human Rights Practices: Slovenia,"Mar 30, 2021 ... On March 20, Prime Minister Jansa accused RTV on Twitter of spreading ...  Culture Ministry State Secretary Ignacija Fridl Jarc said that the ministry ... who  collaborated with the Nazi occupying forces during World War II, on an ...",https://www.state.gov/reports/2020-country-reports-on-human-rights-practices/slovenia/
un.org,A World Free from Genocide Address of the Prime Minister of the ...,Address of the Prime Minister of the Republic of Slovenia Janez Janša at the 67th  Session of ... Rights Council helped to promote the culture of prevention. ... I  would like to remind you that only after the 2nd World War more than 80 countries  ...,https://gadebate.un.org/sites/default/files/gastatements/67/SI_en.pdf
librarystack.org,Political Science | Subjects | LIBRARYSTACK,"... during the cold war, the first Gulf War, and now the so-called “war on terror. ...  media critic Alessandro Ludovico interviews the three artists named Janez Janša.  ... become the hallmark of United States visual culture in the twenty-first century.",https://www.librarystack.org/subject/political-science/
culturaldiplomacy.org,Academy for Cultural Diplomacy,"An International Congress on ""Soft Power"", Cultural Diplomacy and  Interdependence ... President of the Slovenian Democratic Party (1993-present),  Mr. Janez Janša, ... Recognised as having a strong anti-war stance, Dr. Tuomioja  is also a ...",https://www.culturaldiplomacy.org/academy/index.php?en_www_speakers
samoburja.com,"Slavoj Žižek: Coronavirus, Black Lives Matter, and revolution | Samo ...","Jun 30, 2020 ... I interviewed cultural critic and Hegelian philosopher Slavoj Žižek on Thursday,  June ... And you described these measures as “war communism”, drawing ...  Even now when Janez Janša, this young right wing nationalist, is in ...",https://samoburja.com/slavoj-zizek-coronavirus-black-lives-matter-and-revolution/
uic.edu,Fall 2014,"•Fiorina, M. (2010) Culture War? The Myth of a Polarized Public. ... •Jansa, J. &  Gray, V. (2014), The politics and economics of corporate subsidies in the 21st ...",http://pols.uic.edu/wp-content/uploads/sites/273/2018/10/syll_POLS212Fall2014Alexander.pdf
state.gov,Secretary Michael R. Pompeo and Slovenian Prime Minister Janez ...,"Aug 13, 2020 ... PRIME MINISTER JANSA: (Via Translation) Thirty-two years ago, ... If we  believed during the Cold War that the greatest danger was the nuclear ...",https://2017-2021.state.gov/secretary-michael-r-pompeo-and-slovenian-prime-minister-janez-jansa-at-a-press-availability/
abdn.ac.uk,"Professor Amy Bryzgel | Staff Profile | The School of Divinity, History ...","Results 1 - 54 of 54 ... Amy Bryzgel is Chair in Film and Visual Culture at the University of Aberdeen. ...  Mailart, the New Left and Cultural Relations during the Cold War' ... The  Imponderability of Life [in Progress]: (Janez Janša: Life II [in Progress].",https://www.abdn.ac.uk/sdhp/profiles/a.bryzgel?rs=100
jhu.edu,Search Results | Page 4 | Johns Hopkins University Press Books,Results 31 - 40 of 175 ... Add to Cart · 'Opossums' cover image · Opossums. An Adaptive Radiation of New  World Marsupials. Robert S. Voss and Sharon A. Jansa.,https://jhupbooks.press.jhu.edu/book-search/field_jhup_subject/life-sciences-1121/field_binding_type/ebook?page=3
robert-schuman.eu,The Letter n°567 - Robert Schuman Foundation,"On 15th February 2013 the 27 Education, Youth and Culture Ministers of the  European ... After this meeting, in which the Prime Minister Janez Jansa took part,  the ... The G20's major powers committed not to sink into an ""economic war""  casting ...",https://www.robert-schuman.eu/lettre.php?num=567&lg=en
nomos-elibrary.de,The Slovenian Peace Movement: An Insider's Account,"Jun 21, 1991 ... the pre-war crisis in Yugoslavia both “from below” (Helsinki Citizens' As- ...  International, the Swiss basic democracy movements, French cultural and ... See  also Janez Janša, Sedem let pozneje (Ljubljana: Karantanja,.",https://www.nomos-elibrary.de/10.5771/9783845239156-63.pdf?download_full_pdf=1
springer.com,Download book PDF,"Sep 25, 2009 ... and Greek history, European integration history, the Cold War and trans- ... Over  the past five years he has helped to bring education and culture to ... in the Prime  Minister, Janez Janša, and not perceived as a united political.",https://link.springer.com/content/pdf/10.1007%2F978-3-642-00560-2.pdf
hcommons.org,From <em>CORE</em> – Advocating for the Humanities ...,"Item 1 - 18 ... Author(s):: Tim Jansa, William Nichols (see profile); Date: 2020; Group(s): ...  Iberian Studies, Interdisciplinary Approaches to Culture and Society, LLC ...  Change: Analysing the Causes of Power Shifts in Africa Since the Cold War.",https://hcommons.org/groups/humanities-march/deposits/
brill.com,Index in: The Media of Memory,"Aug 27, 2020 ... Janša, Janez 95, 99, 207 ... cultural 16, 160, 173, 223, 224, 225, 227, 229, 232,  233, 235, 238 ... Monument to the Victims of All Wars 26, 32.",https://brill.com/view/book/edcoll/9783657704477/back-1.xml?language=en
balkaninsight.com,"Jansa is Eroding Press Freedom in Slovenia, IPI Warns | Balkan ...","Sep 2, 2020 ... On August 25, the government responded to an alert on the Council of Europe's  platform, which monitors press freedom, issued in May, attaching ...",https://balkaninsight.com/2020/09/02/jansa-is-eroding-press-freedom-in-slovenia-ipi-warns/
voanews.com,Media Freedom in Slovenia Under EU Scrutiny | Voice of America ...,"Mar 19, 2021 ... Jansa and his administration say coverage is overly critical because the majority  of outlets support center-left parties. But many journalists and ...",https://www.voanews.com/press-freedom/media-freedom-slovenia-under-eu-scrutiny
rsf.org,Six press freedom NGOs ask the European Commission to respond ...,"Mar 16, 2021 ... Slovenian Prime minister Janez Jansa (photo: Joe Klamar / AFP) ... The  undersigned press freedom and journalists' organisations from across ...",https://rsf.org/en/news/six-press-freedom-ngos-ask-european-commission-respond-publicly-slovenian-prime-ministers-attacks
mfrr.eu,Press freedom threatened in Slovenia under PM Janša – Media ...,"... old agenda: Press freedom strained again in Slovenia under veteran PM Janša . MFRR partner, the International Press Institute (IPI) explores the downturn in ...",https://www.mfrr.eu/press-freedom-threatened-in-slovenia-under-pm-jansa/
socialistsanddemocrats.eu,S&D Group: PM Janša must be held accountable for attacks on ...,"Mar 26, 2021 ... Today Slovenian Prime Minister Janez Janša made a brief appearance at the ...  Janša's systematic dismantling of media freedom, his insults to ...",https://www.socialistsanddemocrats.eu/newsroom/sd-group-pm-jansa-must-be-held-accountable-attacks-media-freedom-slovenia
dw.com,"Slovenian Press Freedom Is Suffering, Journalists Say | Europe ...","Jan 27, 2008 ... They accuse Slovenian Prime Minister Janez Jansa and his government of  seriously violating the freedom of the press. Accusation of ...",https://www.dw.com/en/slovenian-press-freedom-is-suffering-journalists-say/a-3085350
reuters.com,"EU singles out Poland, Hungary, Slovenia over sliding media freedom","Mar 10, 2021 ... The EU's executive also condemned Slovenian Prime Minister Janez Jansa's  criticism of a reporter who wrote a piece saying media freedom ...",https://www.reuters.com/article/eu-democracy-media/eu-singles-out-poland-hungary-slovenia-over-sliding-media-freedom-idUSL8N2L853K
coe.int,Protection and safety of journalists,"Apr 7, 2020 ... CategoryOther acts having chilling effects on media freedom ... Prime Minister of  Slovenia Janez Janša used social media to accuse Slovenian ...",https://www.coe.int/en/web/media-freedom/detail-alert?p_p_id=sojdashboard_WAR_coesojportlet&p_p_lifecycle=0&p_p_col_id=column-3&p_p_col_count=7&_sojdashboard_WAR_coesojportlet_alertPK=62851325
nytimes.com,Slovene leader accused of media censorship - The New York Times,"Jan 8, 2008 ... Jansa, asked last week whether he was stifling the media, was emphatic: If the  main measure of press freedom ""is the possibility to criticize the ...",https://www.nytimes.com/2008/01/18/world/europe/18iht-SLOVENIA.4.9331908.html
civicspacewatch.eu,Freedom of association - SLOVENIA: Peaceful assembly and media ...,"Oct 30, 2020 ... Protests, especially Friday anti-government protests (see more below), have  been a regular feature of public life in Slovenia since Janša took ...",http://civicspacewatch.eu/slovenia-peaceful-assembly-and-media-freedom-strained-under-jansas-government/
equaltimes.org,"In Central and South-Eastern Europe, media freedom is under attack ...","Aug 24, 2020 ... On being elected prime minister of Slovenia at the beginning of March, Janez  Janša, the conservative leader of the right-wing Slovenian ...",https://www.equaltimes.org/in-central-and-south-eastern
youtube.com,Janez Janša disconnected to avoid EU debate on Media freedom in ...,"Mar 31, 2021 ... Exchange of views at the Democracy, Rule of Law, and Fundamental Rights  Monitoring Group (DRFMG) with the participation of Janez Janša, ...",https://www.youtube.com/watch?v=8qqTUxFPpvg
theowp.org,Slovenia's Media and Press Freedoms Face Troubling Trends on a ...,"Mar 31, 2021 ... ... work environment, fear in doing their work, and a decline in press freedom  under the government of Slovenian Prime Minister Janez Jansa.",https://theowp.org/slovenias-media-and-press-freedoms-face-troubling-trends-on-a-crucial-year/
europa.eu,Media freedom in Slovenia: MEPs to continue taking stock of recent ...,"Mar 25, 2021 ... Janez Janša, Prime Minister of the Republic of Slovenia · Vasko Simoniti, Culture  Minister of Slovenia.",https://www.europarl.europa.eu/news/en/press-room/20210322IPR00514/media-freedom-in-slovenia-meps-to-continue-taking-stock-of-recent-developments
go.com,EU commission condemns Slovenia PM for insulting journalists ...,"Feb 18, 2021 ... Reporters Without Borders has urged the EU to remind Janša that press freedom  is a key principle of the 27-nation bloc. Asked whether the ...",https://abcnews.go.com/International/wireStory/eu-commission-condemns-slovenia-pm-insulting-journalists-75969416
euronews.com,EU condemns Slovenian PM Janez Jansa over 'insulting' journalist ...,"Feb 19, 2021 ... Reporters Without Borders has urged the EU to remind Jansa that press freedom  is a key principle of the 27-nation bloc. Slovenia is due to take ...",https://www.euronews.com/2021/02/19/eu-condemns-slovenian-pm-janez-jansa-over-insulting-journalist
ifex.org,Slovenia: A swift downturn in press and media freedom - IFEX,"Sep 2, 2020 ... In the last 6 months, Prime Minister Janez Janša - who took office in March 2020  and previously governed the country on two prior occasions ...",https://ifex.org/slovenia-a-swift-downturn-in-press-and-media-freedom/
osce.org,OSCE Media Freedom Representative urges public officials in ...,"Mar 27, 2020 ... VIENNA, 27 March 2020 – The OSCE Representative on Freedom of the Media,  ... (RTV SLO), by the Prime Minister of Slovenia, Janez Janša.",https://www.osce.org/representative-on-freedom-of-media/449287
euobserver.com,EU institutions brace for impact of Slovenia's Janša,"Apr 1, 2021 ... In Brussels, there is concern - but also faith that Janez Janša cannot have ... with  media freedom and attacks on journalists in Slovenia,"" Janša ...",https://euobserver.com/democracy/151422
euractiv.com,S&D Group: PM Janša must be held accountable for attacks on ...,"Mar 26, 2021 ... Today Slovenian Prime Minister Janez Janša made a brief appearance at the ...  Janša's systematic dismantling of media freedom, his insults to ...",http://pr.euractiv.com/pr/sd-group-pm-jan-must-be-held-accountable-attacks-media-freedom-slovenia-215157
liberties.eu,Slovenia: New Government Targeting NGOs and the Media :: Civil ...,"Apr 21, 2020 ... When the national press agency, STA, published a report about the letter of the  international media freedom organisations, Prime Minister Janša ...",https://www.liberties.eu/en/stories/new-slovenian-government-targeting-ngos-and-media/18520
rcmediafreedom.eu,Slovenia: media freedom at risk / News / Media Freedom in Europe ...,"Feb 16, 2021 ... ""Slovenia's prime minister, Janez Janša, whose country takes over the Council of  the EU's rotating presidency later this year, has repeatedly and ...",https://www.rcmediafreedom.eu/News/Slovenia-media-freedom-at-risk
total-slovenia-news.com,"MEPs Send Questions to Govt, Janša & Simoniti About Media ...","Apr 13, 2021 ... ... to the Slovenian government, Prime Minister Janez Janša and Culture Minister  Vasko Simoniti, as it is trying to fully assess media freedom in ...",https://www.total-slovenia-news.com/politics/8108-meps-send-questions-to-govt-jansa-simoniti-about-media-freedom-in-slovenia
barrons.com,Slovenia PM Cuts Short MEPs' Grilling On Media Freedom | Barron's,"Mar 26, 2021 ... Janez Jansa, speaking by video link, repeatedly asked the chair of the European  Parliamentary committee on civil liberties, Sophie in 't Veld, to ...",https://www.barrons.com/news/slovenia-pm-cuts-short-meps-grilling-on-media-freedom-01616775906
apnews.com,EU commission condemns Slovenia PM for insulting journalists,"Feb 18, 2021 ... Reporters Without Borders has urged the EU to remind Janša that press freedom  is a key principle of the 27-nation bloc. Asked whether the ...",https://apnews.com/article/europe-journalists-viktor-orban-media-slovenia-b248c9a94871db3377a3c41061b13e80
agenceurope.eu,"In European Parliament, discussion with Janez ... - AGENCE EUROPE","Mar 27, 2021 ... FUNDAMENTAL RIGHTS - SOCIETAL ISSUES / Media ... discussion with Janez  Janša on press freedom in Slovenia turns into a fiasco.",https://agenceurope.eu/en/bulletin/article/12687/1
usnews.com,Brussels Condemns Slovenian Premier's Criticism of Reporter ...,"Feb 18, 2021 ... ... Thursday condemned Slovenian Prime Minister Janez Jansa's criticism of a  reporter who wrote a piece suggesting that media freedom was ...",https://www.usnews.com/news/world/articles/2021-02-18/eu-commission-condemns-slovenian-pm-criticism-of-media
bird.tools,slovenia Archives - BIRD,"Jansa denies restricting media freedoms, and wrote a letter to von der Leyen in ...  press freedom watchdog organisations have already accused Jansa of using ...",https://bird.tools/tag/slovenia/
wikipedia.org,2020–2021 Slovenian protests - Wikipedia,The 2020 Slovenian protests are ongoing mostly peaceful protests against Janez  Janša's ... Janez Janša has been accused of eroding freedom of media since  assuming office. According to a report by International Press Institute Slovenia  has ...,https://en.wikipedia.org/wiki/2020%E2%80%932021_Slovenian_protests
economist.com,Worries about freedom of the press | The Economist,"Apr 1, 2014 ... Mr Jankovic was unable to form a government. Instead Janez Jansa (pictured),  the leader of the right-of-centre SDS, which came second in the ...",https://www.economist.com/eastern-approaches/2014/04/01/worries-about-freedom-of-the-press
article19.org,Slovenia: European journalist and press freedom groups condemn ...,"Oct 1, 2020 ... As outlined in a media freedom alert issued by the Council of Europe, ... to  Slovenian Prime Minister Janez Janša, bringing the total so far to 39.",https://www.article19.org/resources/slovenia-european-journalist-and-press-freedom-groups-condemn-slapp-lawsuits-against-investigative-news-outlet-in-slovenia/
cpj.org,Police question 2 Slovenian journalists at public broadcaster RTV ...,"Oct 5, 2020 ... In March, Prime Minister Janez Janša published an essay titled “War with the  media,” in which he attacked RTV journalists and others, alleging ...",https://cpj.org/2020/10/police-question-2-slovenian-journalists-at-public-broadcaster-rtv/
cjr.org,A helicopter crash in Alaska reverberates through Europe's media ...,"Mar 31, 2021 ... Around the time of the takeover, press-freedom groups including Reporters ... In  the fall, Janša openly rejoiced when Kellner took control of the ...",https://www.cjr.org/the_media_today/petr_kellner_alaska_europe_media.php
sloveniatimes.com,Commissioner contacts Slovenian authorities over media freedom ...,"Apr 25, 2020 ... In March Zgaga received death threats and was the subject of defamatory attacks  by media affiliated with Janša's Democrats (SDS) following a ...",https://sloveniatimes.com/commissioner-contacts-slovenian-authorities-over-media-freedom/
publicmediaalliance.org,Slovenia's public broadcaster pressured by government - Public ...,"Apr 24, 2020 ... Read more: Governments must not use coronavirus as an excuse to curtail media  freedom. Janša's tweet was also criticised by the Journalists' ...",https://www.publicmediaalliance.org/slovenias-public-broadcaster-pressured-by-government/
macaubusiness.com,Embattled Slovenia PM Jansa faces impeachment attempt,"Apr 3, 2021 ... The impeachment motion also says Jansa has violated the constitution by  attacking press freedom — including preventing funding to the ...",https://www.macaubusiness.com/embattled-slovenia-pm-jansa-faces-impeachment-attempt/
reneweuropegroup.eu,Slovenia : freedom of the press is not negotiable - News - Renew ...,"Feb 25, 2021 ... The government of Janez Janša must immediately stop any actions against  independent media and comply with the law. Europe cannot afford ...",https://reneweuropegroup.eu/en/news/1816-slovenia-freedom-of-the-press-is-not-negotiable/
eudebates.tv,EU debates Media freedom in Slovenia with Slovenian PM Janez ...,"Mar 31, 2021 ... Parliament's monitoring group has invited the Slovenian Prime Minister Janez  Janša to investigate Media freedom in Slovenia.",https://eudebates.tv/debates/eu-policies/justice-citizens-rights/eu-debates-media-freedom-in-slovenia-with-slovenian-pm-janez-jansa/
coe.int,Promoting Media Freedom: Focus on Western Balkans,"Sep 18, 2020 ... Media freedom is attacked. 26. Jansa is eroding press freedom in. Slovenia, IPI  warns. ✓ Jansa has launched “vitriolic attacks on reporters on ...",https://rm.coe.int/pr-isd-2020-09-council-of-europe-promoting-media-freedom-in-western-ba/16809f9b02
thefirstnews.com,Open Letter from EANA to Slovenian Prime Minister Janša – The ...,"Dec 14, 2020 ... Dear Mr. Janša,. We are certain that you agree with us when we underline the  importance of the freedom of media from any political ...",https://www.thefirstnews.com/article/open-letter-from-eana-to-slovenian-prime-minister-jansa-18371
justsecurity.org,The Noxious Nexus of Money and Politics Takes Another Turn in ...,"Mar 18, 2021 ... The press freedom organizations expressed concern to Kellner over risks that ...  Janša's actions to have had “a toxic effect on media freedom.”.",https://www.justsecurity.org/75393/the-noxious-nexus-of-money-and-politics-takes-another-turn-in-central-and-southeastern-europe/
ground.news,"Jansa is Eroding Press Freedom in Slovenia, IPI ... - Ground News",A new report by the International Press Institute notes with concern a decline in  press freedom in Slovenia since the new government under Janez Jansa came ...,https://ground.news/article/ede65e12-8ebe-4cad-896e-eadfacae05f2
europeanjournalists.org,EFJ condemns discrediting of journalists by Slovenian PM ...,"May 14, 2020 ... Turning specifically to Slovenian media, Janša singles out the public ... The EFJ  reported today this media freedom violation to the Council of ...",https://europeanjournalists.org/blog/2020/05/14/efj-condemns-the-discrediting-of-journalists-by-the-slovenian-prime-minister/
rferl.org,EU Lawmakers Debate 'Worrying Developments' For Media ...,"Mar 10, 2021 ... ... of ""worrying developments"" for media freedoms in Hungary, Poland, ... attempts  by Prime Minister Janez Jansa's government to ""undermine ...",https://www.rferl.org/a/hungary-european-parlaiment-media-freedom-debate-orban-poland-slovenia/31143267.html
timesofmalta.com,Embattled Slovenia PM Jansa faces impeachment attempt,"Apr 2, 2021 ... The impeachment motion also says Jansa has violated the constitution by  attacking press freedom - including preventing funding to the ...",https://timesofmalta.com/articles/view/embattled-slovenia-pm-jansa-faces-impeachment-attempt.862108
hrnjuganda.org,Slovenia: A swift downturn in press and media freedom | Human ...,"Sep 3, 2020 ... But the attacks on journalists do not end with social media abuse. Janša's right- wing Slovenian Democratic Party (SDS) has again begun to try ...",https://www.hrnjuganda.org/slovenia-a-swift-downturn-in-press-and-media-freedom/
whbl.com,EU Commission condemns Slovenian PM criticism of media | 1330 ...,"Feb 18, 2021 ... ... Thursday condemned Slovenian Prime Minister Janez Jansa's criticism of a  reporter who wrote a piece suggesting that media freedom was ...",https://whbl.com/2021/02/18/eu-commission-condemns-slovenian-pm-criticism-of-media/
pengovsky.com,press freedom | SLEEPING WITH PENGOVSKY,The temper tantrum Slovenian prime minister Janez Janša threw Friday  afternoon during a European Parliament hearing only reiterated what was  becoming ...,http://www.pengovsky.com/tag/press-freedom/
yahoo.com,Brussels condemns Slovenian premier's criticism of reporter,"Feb 18, 2021 ... ... Thursday condemned Slovenian Prime Minister Janez Jansa's criticism of a  reporter who wrote a piece suggesting that media freedom was ...",https://ca.movies.yahoo.com/eu-commission-condemns-slovenian-pm-130111188.html
globalvoices.org,"Called a prostitute by the prime minister, a Slovenian journalist tells ...","Mar 9, 2021 ... Media freedom has come under attack from the Prime Minister, who has ... When  Janša later became Slovenian prime minister, the online ...",https://globalvoices.org/2021/03/09/called-a-prostitute-by-the-prime-minister-a-slovenian-journalist-tells-her-story/
occrp.org,Hungary Wants Slovenia to Discipline its Media,"Apr 9, 2019 ... Slovenia's Janez Jansa and Hungary's Viktor Orban (Photo: EPP CC ... of  freedom of the press and freedom of expression,” the Ambassador ...",https://www.occrp.org/en/daily/9539-hungary-wants-slovenia-to-discipline-its-media
sta.si,MEPs address to govt series of questions about media freedom ... - STA,"Apr 12, 2021 ... ... to the Slovenian government, Prime Minister Janez Janša and Culture Minister  Vasko Simoniti, as it is trying to fully assess media freedom in ...",https://english.sta.si/2889320/meps-address-to-govt-series-of-questions-about-media-freedom-other-topics
mappingmediafreedom.org,Slovenia – Mapping Media Freedom,"On 7 April 2021, Slovenian Prime Minister Janez Janša accused German  journalist Nikolaus Neumaier from the ARD broadcaster of “censorship in the  style” of the ...",https://www.mappingmediafreedom.org/country-profiles/slovenia/
refworld.org,Former PM sues Finnish journalist for 1.5 million euros ... - Refworld,"Feb 2, 2010 ... ""Like any person who considers he has been defamed by a media report, Jansa  could have used his right of reply before thinking of suing for ...",https://www.refworld.org/docid/57bc2054e.html
luiss.it,Safeguarding the key for democracy: the European mission to ...,"Mar 24, 2021 ... After acknowledging the vital importance of press freedom and media ... The  relationship between Janez Janša's government and media ...",https://croie.luiss.it/2021/03/24/safeguarding-the-key-for-democracy-the-european-mission-to-enforce-media-freedom-and-pluralism/
eurozine.com,The problems of Slovenian journalists | Eurozine,"Jan 2, 2008 ... But the larger story about curtailing freedom of the press in Slovenia is ... to help  stop the pressures on journalists from Prime Minister Jansa.",https://www.eurozine.com/the-problems-of-slovenian-journalists/
state.gov,PDF version,over whether former prime minister Jansa could sit on the committee. ... Press  Freedoms: Media outlets are subject to the same laws that prohibit hate speech  as ...,https://2009-2017.state.gov/documents/organization/236790.pdf
ifj.org,Slovenia: news agency funding cut puts press freedom at risk - FIJ,"Dec 7, 2020 ... Slovenia: news agency funding cut puts press freedom at risk ... The decision  was confirmed by Slovenian Prime Minister, Janez Janša.",https://www.ifj.org/fr/salle-de-presse/nouvelles/detail/category/press-releases/article/slovenia-news-agency-funding-cut-puts-press-freedom-at-risk.html
