domena,naslov,opis,link
rtvslo.si,Il premier Janša: SI ad un confronto sullo stato dei media in Slovenia ...,"3 mar 2021 ... Il premier Janez Janša e il ministro della cultura, Vasko Simoniti, ... più  accomunare la Slovenia alla Polonia e all'Ungheria aveva detto che ...",https://www.rtvslo.si/capodistria/radio-capodistria/notizie/europa/il-premier-jansa-si-ad-un-confronto-sullo-stato-dei-media-in-slovenia/571572
euronews.com,Unione europea: Ungheria e Polonia confermano il veto al bilancio ...,"20 nov 2020 ... Vertice Unione europea: Ungheria e Polonia confermano il veto al ... subito dopo  dall'intervento delPpremier sloveno Janez Jansa, che non ha ...",https://it.euronews.com/2020/11/20/summit-ue-bilancio-al-palo-ungheria-e-polonia-confermano-il-veto
eastjournal.net,Ungheria e Slovenia ai ferri corti per la copertina di un giornale ...,"9 apr 2019 ... C'è tensione diplomatica tra Ungheria e Slovenia per la recente ... stesso Janša e  di altri due parlamentari di SDS, Milan Zver e Branko Grims.",https://www.eastjournal.net/archives/97303
corriere.it,Lagarde spinge sul Recovery fund Ma Merkel avvisa: restano i veti ...,"20 nov 2020 ... Oltre ai leader ungherese Orbán e polacco Morawiecki, ha parlato il premier  sloveno Janez Janša, che nei giorni scorsi ha sostenuto le ...",https://www.corriere.it/economia/aziende/20_novembre_20/01-economia-apretxtcorriere-web-sezioni-3aea189a-2abb-11eb-a3fb-78126c23822f.shtml
formiche.net,Non solo coronavirus. Ecco come l'autoritarismo dilaga in Ue ...,"9 apr 2020 ... I governi di Ungheria, Slovenia e Polonia si muovono in modo ... Si tratta di Ivan  Janša, tornato a fare il capo del governo lo scorso marzo e che ...",https://formiche.net/2020/04/coronavirus-autoritarismo-ue/
cambridge.org,"Italy, the Roman Protocols Bloc, and the Anschluβ Question 1936 ...","283, Kánya and Vinci conversation, 29 July 1937;Sakmyster, Hungary, the Great  Powers, and the Danubian Crisis, ... NPA 412, Liebitzky to Jansa, 1 April 1937.",https://www.cambridge.org/core/journals/austrian-history-yearbook/article/italy-the-roman-protocols-bloc-and-the-anschlu-question-19361938/45723B3029162BE153377B1B195948DD
globalist.it,"Blocco Recovery Fund, la Slovenia sostiene i sovranisti polacchi e ...","18 nov 2020 ... La Slovenia ha deciso di affiancare la Polonia e l'Ungheria nel loro veto ... non  una maggioranza politica"", ha scritto Janez Jansa in una lettera ...",https://www.globalist.it/world/2020/11/18/blocco-recovery-fund-la-slovenia-sostiene-i-sovranisti-polacchi-e-ungheresi-non-e-l-ue-a-definire-lo-stato-di-diritto-2068394.html
plinovodi.si,PCI 6.23 Hungary – Slovenia interconnection (Nagykanizsa ...,"PCI 6.23 Hungary – Slovenia interconnection (Nagykanizsa — ... Slovenia and  Hungary ... Nika Janša (e-mail: nika.jansa@plinovodi.si, tel.: +386 1 58 20 741).",http://www.plinovodi.si/media/4765/pci-information-leaflet-623.pdf
open.online,Orban rivendica il veto sul Recovery Fund: «L'Ue ricatta chi si ...,18 nov 2020 ... Il primo ministro dell'Ungheria Viktor Orban ha pubblicato una serie di ... Slovenia  Janez Jansa è sulla stessa linea di Orban: «Solo un organo ...,https://www.open.online/2020/11/18/orban-rivendica-il-veto-sul-recovery-fund/
rainews.it,Videoconferenza Ue: il veto di Ungheria e Polonia blocca il ...,"19 nov 2020 ... Anche il premier sloveno Janez Janša ritiene, come Viktor Orbán (Ungheria) e  Mateusz Morawiecki (Polonia), che il meccanismo concordato ...",https://www.rainews.it/dl/rainews/articoli/Videoconferenza-UE-Covid-19-e-veto-di-Ungheria-e-Polonia-sui-fondi-per-il-rilancio-degli-Stati-Europei-e4194580-ffa7-4170-9177-91e44d109752.html
finestresullarte.info,Preoccupazioni per il governo populista sloveno. “Sta facendo una ...,"10 feb 2021 ... Janša, leader della Slovenska demokratska stranka (SDS, “Partito ... a quello di  altri governi populisti come quello ungherese e quello polacco.",https://www.finestresullarte.info/attualita/preoccupazioni-governo-populista-slovenia-guerra-cultura
diplomaziaitaliana.it,Confine italo-sloveno: telefonata Conte-Jansa - Diplomazia Italiana,"15 mar 2020 ... Tuttavia a seguito delle decisioni di Croazia e Ungheria di impedire l'ingresso  agli automezzi provenienti dall'Italia, la Slovenia ha adottato ...",https://www.diplomaziaitaliana.it/confine-sloveno-conte-jansa/
repubblica.it,Il Recovery Fund bloccato dal veto di Polonia e Ungheria | Rep,"19 nov 2020 ... Lo sloveno Janez Jansa, sempre più intenzionato a schierare il suo Paese con  Ungheria e Polonia, chiede alle due parti di trovare un ...",https://rep.repubblica.it/pwa/generale/2020/11/19/news/il_recovery_fund_bloccato_dal_veto_di_polonia_e_ungheria-275061507/
wallstreetitalia.com,George Soros: l'Ue non faccia sconti a Polonia e Ungheria | WSI,19 nov 2020 ... Secondo il finanziere George Soros il vedo al budget Ue di Ungheria e ... da  parte della Slovenia “il cui primo ministro Janez Jansa è un vicino ...,https://www.wallstreetitalia.com/george-soros-lue-non-faccia-sconti-a-polonia-e-ungheria/
core.ac.uk,Human rights entrepreneurship in post-socialist Hungary: from the ...,"in Budapest, Hungary —the European Roma Rights Centre (ERRC).1The ...  2007 to Janez Jansa, Slovenian Prime Minister (cf. de Groene-Kouwenhoven  2007) ...",https://core.ac.uk/download/pdf/46519307.pdf
huffingtonpost.it,"Crociata dello sloveno Jansa contro i giornalisti, l'Ue balbetta | L ...","18 feb 2021 ... Il premier di Lubiana contro una cronista di politico.eu, rea di aver scritto un  articolo sugli attacchi alla libertà di stampa nel suo paese. A luglio ...",https://www.huffingtonpost.it/entry/crociata-dello-sloveno-jansa-contro-i-giornalisti-lue-balbetta_it_602e8944c5b66dfc101cebb3
mbrusis.eu,Brusis_POPC_web,"Jun 8, 2016 ... bility institutions have been eroded in Hungary and Poland. ... dered Hungary's  democracy more vulnerable. ... Dzurinda and Janez Janša.",http://mbrusis.eu/wp-content/uploads/2016/06/Brusis_POPC_web.pdf
wikipedia.org,Sluvenia - Wikipedia,"Prima Ministru · Janez Janša. Indipendenza, Da a Ghjugoslavia, 25 ghjugnu  1991 ... Spagna - Flag of Sweden.svg Svezia - Flag of Hungary.svg Ungheria ...",https://co.wikipedia.org/wiki/Sluvenia
notiziegeopolitiche.net,Recovery plan. Ungheria e Polonia: la Commissione pronta al piano ...,"3 dic 2020 ... Con Ungheria e Polonia si è schierata anche la Slovenia, il cui premier Janez  Jansa se l'è presa con la maggioranza politica che guida ...",https://www.notiziegeopolitiche.net/recovery-plan-ungheria-e-polonia-la-commissione-pronta-al-piano-b/
europa.eu,"Polonia, Ungheria e Slovenia: la libertà dei media sotto attacco | 08 ...","8 mar 2021 ... I giornalisti sloveni stanno affrontando diffuse molestie e minacce, anche da  parte del Primo ministro Janez Janša, mentre continuano a ...",https://www.europarl.europa.eu/news/it/agenda/briefing/2021-03-08/6/polonia-ungheria-e-slovenia-la-liberta-dei-media-sotto-attacco
quifinanza.it,"Recovery Fund, ancora guai: si allarga fronte del no | QuiFinanza","19 nov 2020 ... ... stato di diritto con la Slovenia che si aggiunge ad Ungheria e Polonia. ... non  una maggioranza politica”, ha scritto Janez Jansa in una lettera ...",https://quifinanza.it/soldi/recovery-fund-ancora-guai-si-allarga-fronte-del-no/434519/
balk.hu,BA Balkanac |,"... lunedì, in Slovenia, Croazia e Bosnia-Erzegovina ci sono state speculazioni  sul fatto che il primo ministro sloveno Janez Janša lo abbia effettivamente inviato  .",https://balk.hu/it/b-a-balkanac/
strisciarossa.it,Sull'Italia l'ombradella Controeuropa - Strisciarossa,"6 giu 2018 ... ... mandando al potere il nazionalsovranista Janez Jansa, protegé del ben ... L' autocrate ungherese sta mettendo in piedi la sua “democrazia ...",http://www.strisciarossa.it/lombra-della-controeuropa-si-allunga-sullitalia/
cci.tn.it,Autori / Home - Centro per la Cooperazione Internazionale,"Slovenia: Ungheria, Polonia e Janša contro il bilancio europeo. 20/11/2020 -  Laurent Geslin, Jean-Arnault Dérens. Dopo aver mostrato il suo sostegno ...",https://www.cci.tn.it/ita/Autori/(author)/Jean-Arnault%20D%C3%A9rens
uibk.ac.at,"1914: Austria-Hungary, the Origins, and the First Year of World War I","On 28 July 1914 Austria-Hungary declared war on Serbia and began  mobilization for Plan B against ... Alfred Jansa: Erinnerungen, ed. Peter Broucek ( Vienna ...",https://www.uibk.ac.at/iup/buch_pdfs/cas23_web.pdf
ungherianews.com,Rassegna stampa: 15-20 novembre - Ungheria News,"20 nov 2020 ... Anche il primo ministro sloveno Janez Jansa si schiera dalla parte polacca e  ungherese, ma senza minacciare il veto. (HVG) Nella settimanale ...",https://ungherianews.com/2020/11/20/rassegna-stampa-15-20-novembre/
iusletter.com,Il Recovery Fund bloccato dal veto di Polonia e Ungheria - Iusletter,"20 nov 2020 ... Lo sloveno Janez Jansa, sempre più intenzionato a schierare il suo Paese con  Ungheria e Polonia, chiede alle due parti di trovare un ...",https://iusletter.com/oggi-sulla-stampa/recovery-fund-bloccato-dal-veto-polonia-ungheria/
ilfattoquotidiano.it,"Recovery, Parlamento Ue: ""No a rinegoziazione degli accordi, non ...","18 nov 2020 ... Meloni dalla parte di Polonia e Ungheria che bloccano gli aiuti per la ... non una  maggioranza politica”, ha scritto Janez Jansa in una lettera ...",https://www.ilfattoquotidiano.it/2020/11/18/recovery-parlamento-ue-no-a-rinegoziazione-degli-accordi-non-cediamo-su-stato-di-diritto-ma-slovenia-si-schiera-con-budapest-e-varsavia/6007636/
publicpolicy.it,Che succede in Ue dopo la rottura tra Orbán e il Ppe - PublicPolicy,"9 mar 2021 ... Il premier ungherese, evidentemente fiutando il pericolo imminente, ... Janez  Jansa) possano lasciare il gruppo proprio per seguire Fidesz.",https://www.publicpolicy.it/che-succede-in-ue-dopo-rottura-orban-ppe-scenari-91661.html
globalproject.info,"Elezioni in Slovenia, vince il fronte xenofobo di Janez Jansa | Global ...","13 giu 2018 ... Quali sono le connessioni ideologiche e finanziarie tra l'SDS ed il governo  ungherese di Orban? Sì, ho dimenticato di menzionarlo come ...",https://www.globalproject.info/it/mondi/elezioni-in-slovenia-vince-il-fronte-xenofobo-di-janez-jansa/21504
caffedeigiornalisti.it,"Nessun timore, nessun favore. Il 3 maggio per un giornalismo libero ...","3 mag 2020 ... Quanto sta accadendo in Ungheria ci deve interessare non soltanto ... di  rilevante attualità: dopo la recente elezione del premier Janez Jansa, ...",https://caffedeigiornalisti.it/nessun-timore-nessun-favore-il-3-maggio-per-un-giornalismo-libero/
thevision.com,Diversi leader stanno approfittando della pandemia per guadagnare ...,"8 apr 2020 ... Anche in passato il leader di Fidesz, il principale partito ungherese, ... Janša ha  anche rimpiazzato i vertici delle forze di sicurezza e di ...",https://thevision.com/coronavirus/lader-potere-pandemia/
ilgiornale.it,Fumata nera sul Recovery Fund: resta il veto di Polonia e Ungheria ...,"19 nov 2020 ... ... l'ungherese Viktor Orban e il polacco Mateusz Morawiecki - non si smuovono,  e anzi hanno trovato un alleato nello sloveno Janez Jansa, ...",https://www.ilgiornale.it/news/economia/fumata-nera-sul-recovery-fund-resta-veto-polonia-e-ungheria-1904428.html
repubblica.it,George Soros esorta l'UE a non piegarsi a Ungheria e Polonia ...,"19 nov 2020 ... Lunedì, Ungheria e la Polonia hanno infatti bloccato l'adozione del ... non una  maggioranza politica"", ha scritto Janez Jansa in una lettera ...",https://finanza.repubblica.it/News/2020/11/19/george_soros_esorta_lue_a_non_piegarsi_a_ungheria_e_polonia-35/
lindro.it,"Ungheria: Coronavirus COVID-19, dal purgatorio all'inferno senza ...","4 apr 2020 ... Ungheria: Viktor Orbán approfitta delll Coronavirus COVID-19 per ... c'è il partito  di Janez Janša, appoggiato anche dagli oligarchi vicini a ...",https://lindro.it/ungheria-coronavirus-covid-19-dal-purgatorio-all-inferno-senza-ritorno/
europa.eu,Membri del Consiglio europeo - Consilium,15 feb 2021 ... Ungheria. Viktor Orbán. Viktor Orbán. Primo ministro. Facebook. Italia ... Slovenia . Janez Janša. Janez Janša. Primo ministro. @JJansaSDS ...,https://www.consilium.europa.eu/it/european-council/members/
confidentenamibia.com,Will Biden and Harris help us breathe again? | Confidente,"Nov 19, 2020 ... ... Modi, Brazil's Jair Bolsonaro, Slovenia's Janez Janša, Hungary's Viktor Orbán,  Turkey's Recep Erdoğan and Russia's Vladimir Putin.",https://confidentenamibia.com/will-biden-and-harris-help-us-breathe-again/
gelocal.it,"Slovenia: controlli rafforzati ai confini maggiori, chiusi i valichi minori ...","29 mar 2021 ... ... governo guidato dal premier Janez Janša prevedono il divieto di espatrio in  Paesi in zona rossa e Italia, Austria, Ungheria e Croazia lo sono.",https://ilpiccolo.gelocal.it/trieste/cronaca/2021/03/29/news/slovenia-ai-confini-maggiori-controlli-rafforzati-chiusi-i-valichi-minori-1.40088143
voxeurop.eu,Incastrata tra autoritarismo e “normalità” - Voxeurop (Italiano),"28 ago 2019 ... Il Partito democratico sloveno (Sds) di Janez Janša e il Partito popolare ... In  contrasto con la retorica prevalente in Ungheria, durante la ...",https://voxeurop.eu/it/incastrata-tra-autoritarismo-e-normalita/
repubblica.it,Carinzia - Austria vicina - Blog - Finegil,... Maas \ Isola Lunga \ Janez Jansa \ Oktoberfest \ Politica \ Sakarun \ Sebastian  ... Lavoro \ Romania \ Schwechat \ Ungheria \ Viktor Orban \ Wolfgang Schüssel.,https://diblas-udine.blogautore.repubblica.it/category/carinzia/page/6/
cdt.ch,Gli USA consigliano ai propri cittadini di «lasciare l'India il prima ...,"1 giorno fa ... Janša si è detto consapevole delle difficoltà che una tale scelta ... Vaccini, anche  Ungheria e Repubblica ceca vogliono allearsi con Israele.",https://www.cdt.ch/mondo/gli-usa-consigliano-ai-propri-cittadini-di-lasciare-l-india-il-prima-possibile-DG3923720
balkaninsight.com,Terrifying Twitter: Slovenia's Marshall Twito and his 'Fake' Friends ...,"Apr 15, 2021 ... Caric, it turned out, was particularly popular with Slovenian Prime Minister Janez  Jansa, known to his critics as Marshall Twito, a nod to Josip ...",https://balkaninsight.com/2021/04/15/terrifying-twitter-slovenias-marshall-twito-and-his-fake-friends/
politico.eu,POLITICO Brussels Playbook: Marshal Tweeto writes a letter ...,"Nov 18, 2020 ... Watch your metaphors: There's more such poetry in Janša's letter, which aims to  convince fellow EU leaders to give in to Hungarian requests and ...",https://www.politico.eu/newsletter/brussels-playbook/politico-brussels-playbook-marshal-tweeto-writes-a-letter-original-takes-parliament-ends-lockdown/
balkaninsight.com,"Janez Jansa, Slovenia's Paranoid Marshal Tweeto | Balkan Insight","Nov 11, 2020 ... Obsessed – like his ally Donald Trump – with a deep state that is out to destroy  him, the Slovene PM is as addicted as Trump to social media ...",https://balkaninsight.com/2020/11/11/janez-jansa-slovenias-paranoid-marshal-tweeto/
economist.com,Populists are threatening Europe's independent public broadcasters ...,"Apr 8, 2021 ... Wags have consequently dubbed Mr Jansa “Marshal Twito”, a nod to Josip Tito,  Yugoslavia's longtime dictator. His government wants to pass a ...",https://www.economist.com/europe/2021/04/08/populists-are-threatening-europes-independent-public-broadcasters
dw.com,Janez Janša – „Maršal Twito“ | Politika | DW | 19.02.2021,"19 velj 2021 ... Janez Janša – „Maršal Twito“. Uzor mu je Donald Trump, piše njemački list  Süddeutsche Zeitung (SZ) o slovenskom premijeru. I dodaje kako ...",https://www.dw.com/hr/janez-jan%C5%A1a-mar%C5%A1al-twito/a-56624035
twito.si,Maršal Twito - Sledilnik,Beležimo in analiziramo Twitter aktivnost @jjansasds.,https://twito.si/
tijd.be,Maarschalk Twito' Jansa in de clinch met Europarlement | De Tijd,28 maart 2021 ... De Sloveense premier Janez Jansa schopt opnieuw keet over de persvrijheid.  Hij zette een hoorzitting via een videolink met het Europees ...,https://www.tijd.be/dossier/europareeks/maarschalk-twito-jansa-in-de-clinch-met-europarlement/10294265.html
nrc.nl,Maarschalk Twito' is de onbekende populist van Europa - NRC,7 dec 2020 ... Janez Jansa: Naast Polen en Hongarije verzet ook Slovenië zich tegen  rechtsstaatseisen van de EU. De radicale premier Jansa gaat al ...,https://www.nrc.nl/nieuws/2020/12/07/maarschalk-twito-is-de-onbekende-populist-van-europa-a4022929
aktualne.cz,"""Maršál Twito"". Kdo je slovinský premiér Janez Janša - Aktuálně.cz","28. březen 2021 ... Bývalý komunista a pozdější disident Janez Janša potřetí vede slovinskou vládu  a dostává se kvůli ... Slovinský ""Maršál Twito"" znepokojuje EU.",https://zpravy.aktualne.cz/zahranici/evropsky-parlament/marsal-twito-kdo-je-slovinsky-premier-janez-jansa/r~86005c068cac11ebb0fa0cc47ab5f122/
mladina.si,Maršal Twito« | MLADINA.si,4 nov 2020 ... Tako je Janez Janša nekemu nič hudega slutečemu Kanadčanu povzročil zelo  razburkano popoldne.« Janšev zloglasni napad na Carpenterja,https://www.mladina.si/202548/marsal-twito/
soundcloud.com,Episode 47: Die tausend Häutungen des Janez Janša oder wieviel ...,28. März 2021 ... Episode 47: Die tausend Häutungen des Janez Janša oder wieviel Orbán steckt  in Marschall Twito? Neues vom Ballaballa-Balkan. 2761. 1:09: ...,https://soundcloud.com/user-89524652/episode-47-die-tausend-hautungen-des-janez-jansa-oder-wieviel-orban-steckt-in-marschall-twito
vecer.com,"Maršal Twito analizira: Na dan, ko smo zabeležili 1685 okužb, naj bi ...","3 dec 2020 ... Janez Janša spremlja dogajanje na svojem pametnem telefonu. ... Inštitut Danes  je nov dan je zagnal projekt Maršal Twito - Sledilnik, ki beleži ...",https://www.vecer.com/slovenija/twito-analizira-so-dnevi-ko-premier-jansa-za-aktivnosti-na-twitterju-porabi-tudi-do-3-ure-10228811
dnevnik.si,Maršal Twito noče skočiti z republikanskega Titanika | Dnevnik,"9 nov 2020 ... Potem ko so ameriški mediji demokratskega kandidata Josepha Bidna že  razglasili za 46. ameriškega predsednika, Janez Janša s tvitanjem ...",https://www.dnevnik.si/1042942838
insajder.com,"Tovariš Twito: Janezu Janši spodrsnilo, retvital »preplonkano ...","3 nov 2020 ... Tovariš Twito: Janezu Janši spodrsnilo, retvital »preplonkano« obsodbo napada  v Avstriji! Oblast je sladka: Tito in Janša. Kdo je največji sin ...",https://insajder.com/slovenija/tovaris-twito-janezu-jansi-spodrsnilo-retvital-preplonkano-obsodbo-napada-v-avstriji
ptujinfo.com,Maršal Twito: Koliko časa preživi premier Janša na Twitterju ...,2 dec 2020 ... Projekt analizira aktivnost Janše na Twitterju. Projekt Maršal Twito – Sledilnik  beleži in analizira aktivnost premierja Janeza Janša na Twitterju.,https://ptujinfo.com/novica/politika-gospodarstvo/marsal-twito-koliko-casa-prezivi-premier-jansa-na-twitterju/155344
greznicablok.si,"Janez ""Cringe"" Janša AKA Maršal Twito | GreznicaBlok","Janez Janša, (@JJansaSDS), v zadnjem času poznan tudi po vzdevku Maršal  Twito, je eden redkih politikov, za katere se zdi, da svoji državi delajo ...",http://greznicablok.si/blog/greznicablog-1/post/janez-cringe-jansa-aka-marsal-twito-10
sueddeutsche.de,Janez Janšas Krieg gegen die slowenischen Medien - Politik - SZ.de,"19. Febr. 2021 ... Sloweniens Premier Janša führt in sozialen Netzwerken einen ... Der siegreiche  Regierungschef, den Spötter auch ""Marschall Twito"" nennen, ...",https://www.sueddeutsche.de/politik/slowenien-jansa-pressefreiheit-1.5210734
sobotainfo.com,Maršal Twito: Koliko ur v povprečju premier Janša preživi na ...,"3 dec 2020 ... Včeraj, prvega decembra, je Janez Janša po ocenah projekta Maršal Twito –  Sledilnik, na družbenem omrežju Twitter preživel eno uro in 24 ...",https://sobotainfo.com/novica/politika-gospodarstvo/marsal-twito-koliko-ur-v-povprecju-premier-jansa-prezivi-na-twitterju
vecerkoroska.com,"Maršal Twito analizira: Na dan, ko smo zabeležili 1685 okužb, naj bi ...","3 dec 2020 ... Robert Balen Janez Janša spremlja dogajanje na svojem pametnem ... Inštitut  Danes je nov dan je zagnal projekt Maršal Twito - Sledilnik, ...",https://www.vecerkoroska.com/vk/aktualno/marsal-twito-analizira-na-dan-ko-smo-zabelezili-1685-okuzb-naj-bi-jansa-na-twitterju-prezivel-vec-kot-3-ure-casa-10228963
democratic-erosion.com,European Broadcasters Under Threat by Populism,"Apr 19, 2021 ... Nicknamed “Marshal Twito ”, a reference to former Yugoslavian dictator Josip Tito , Jansa has recently been attacking Radio Television of ...",https://www.democratic-erosion.com/2021/04/19/european-broadcasters-under-threat-by-populism/
nova24tv.si,"Maršal Twito – to je resen žurnalizem avstrijskega ""Malega časopisa ...","1 mar 2021 ... ""Če ponavljaš laž dovolj pogosto, ta postane (resnica) novinarstvo,"" se je premier  Janez Janša odzval na še en posmehljiv zapis tujega medija ...",https://nova24tv.si/slovenija/politika/marsal-twito-to-je-resen-zurnalizem-avstrijskega-malega-casopisa/
ballaballa-balkan.de,47 – Die tausend Häutungen des Janez Janša oder wieviel Orbán ...,"47 – Die tausend Häutungen des Janez Janša oder wieviel Orbán steckt in  Marschall Twito? Um eines gleich klarzustellen: Nein, wir sind nicht schuld daran , ...",https://ballaballa-balkan.de/47-die-tausend-hautungen-des-janez-jansa-oder-wieviel-orban-steckt-in-marschall-twito/
kleinezeitung.at,Janez Jansa: Trumps Fan und seine Liebe zum vorschnellen Tweet ...,13. Nov. 2020 ... ... Premier Janez Jansa in Anlehnung an Jugoslawiens einstigen Staatslenker  Josip Broz Tito den Spitznamen „Marschall Twito“ beschert.,https://www.kleinezeitung.at/politik/aussenpolitik/5896627/Janez-Jansa_Trumps-Fan-und-seine-Liebe-zum-vorschnellen-Tweet
gov.si,"Zahtevek za objavo popravka članka, objavljenega na spletni strani ...","23 feb 2021 ... 2021 z izvirnim naslovom ""Marschall Twito kämpft gegen Geister des ... ""Janša  resigned because he was convicted of corruption and had to go ...",https://www.gov.si/novice/2021-02-23-zahtevek-za-objavo-popravka-clanka-objavljenega-na-spletni-strani-neue-zuercher-zeitung/
newsbeezer.com,Marshal Twito – the next problem leader in the EU?,"Mar 2, 2021 ... Prime Minister Janez Jansa arouses angry feelings both inside and outside the  country. Right-wing politician Janez Jansa is in her third term as ...",https://newsbeezer.com/swedeneng/marshal-twito-the-next-problem-leader-in-the-eu/
woz.ch,Marschall Twito greift durch | WOZ Die Wochenzeitung,11. März 2021 ... Der slowenische Premier Janez Jansa will die Medien unter Kontrolle bringen.  Dabei orientiert er sich an Viktor Orbans Stil. Doch ist er auch so ...,https://www.woz.ch/-b4b2
seznam.cz,"Slovinský ""Maršál Twito"" znepokojuje EU. Janša útočí na novináře a ...",Bývalý komunista a pozdější disident Janez Janša potřetí vede slovinskou vládu  a dostává se kvůli útokům na média do sporů s Bruselem.,https://www.seznam.cz/komentare/11032864-slovinsky-marsal-twito-znepokojuje-eu-jansa-utoci-na-novinare-a-obdivuje-orbana
apple.com,‎Neues vom Ballaballa-Balkan: Episode 47: Die tausend Häutungen ...,Seit gut einem Jahr ist Janez Janša (mal wieder) Premierminister Sloweniens. ...  Häutungen des Janez Janša oder wieviel Orbán steckt in Marschall Twito?,https://podcasts.apple.com/gh/podcast/episode-47-die-tausend-h%C3%A4utungen-des-janez-jan%C5%A1a-oder/id1170436903?i=1000514777909
hd.se,Marskalk Twito – nästa problemledare i EU? - HD,2 mar 2021 ... Öknamnet ”Marskalk Twito” har 62-årige Jansa fått av sina motståndare av  dubbla orsaker. Dels är det en ordlek med namnet på det forna ...,https://www.hd.se/2021-03-02/marskalk-twito-nasta-problemledare-i-eu
danesjenovdan.si,Danes je nov dan,"Terrifying Twitter: Slovenia's Marshall Twito and his 'Fake' Friends. Balkan Insight , 15. 04. 2021 ... Vote pro: Janez Janša. 01. 12. 2015 ...",https://danesjenovdan.si/en
vezjak.com,Maršal Twito in njegova pisma Evropi: potapljajoča se ladja ugleda ...,"18 nov 2020 ... ... posmehljivo pospremil z »Maršal Twito piše pismo«. V njem je Janša svoje  pisanje voditeljem EU, tudi Ursuli von der Leyen in Angeli Merkel, ...",https://vezjak.com/2020/11/18/marsal-twito-in-njegova-pisma-evropi-potapljajoca-se-ladja-ugleda-slovenije/
pengovsky.com,Laying For Living | SLEEPING WITH PENGOVSKY,"Feb 17, 2021 ... Politico Europe journalist writes an article on Janez Janša and his crusade  against the media and the ... Marshal Twito marshaling his minions.",https://www.pengovsky.com/2021/02/17/laying-for-a-living/
had.si,"Matej Tonin prosil Janeza Janšo, da za mesec dni odloži tviter ...",12 dec 2020 ... Sami lahko preverite to na Maršal Twito sledilniku. ... da je po “intervenciji”  Mateja Tonina Janez Janša še dodatno namenil veliko časa tvitanju.,https://www.had.si/blog/2020/12/12/matej-tonin-prosil-janeza-janso-da-za-mesec-dni-odlozi-tviter-preveri-na-twito-si-ce-se-janez-drzi-prosnje/
blesk.cz,"Soros, Jourová, migranti. Janša jako Orbán bojuje proti médiím ...","6. březen 2021 ... Slovinský premiér Janez Janša vede na twitteru slovní válku proti ... MiniTrump  alias Maršál Twito: Slovinský premiér ostřeluje novináře, čelí mu ...",https://www.blesk.cz/clanek/zpravy-svetova-edice/671505/minitrump-alias-marsal-twito-slovinsky-premier-ostreluje-novinare-celi-mu-i-jourova.html
aftonbladet.se,Marskalk Twito – nästa problemledare i EU? | Aftonbladet,1 mar 2021 ... Högerpolitikern Janez Jansa är inne på sin tredje omgång som premiärminister i  Slovenien. Arkivfoto. NYHETER. Ungern och Polen är på ...,https://www.aftonbladet.se/nyheter/a/yRm4e2/marskalk-twito--nasta-problemledare-i-eu
