domena,naslov,opis,link
taz.de,Slowenien als Gastland der Buchmesse: Die neue Achse des Bösen ...,"22. Apr. 2021 ... Unter Premier Janša ist die Presse- und Kunstfreiheit in Slowenien bedroht. Auch  Renata Zamida, Leiterin der Nationalen Buchagentur, wurde ...",https://taz.de/Slowenien-als-Gastland-der-Buchmesse/!5766706/
boersenblatt.net,Presse- und Kunstfreiheit in Slowenien bedroht,vor 4 Tagen ... Der rechtspopulistische slowenische Ministerpräsident Janez Janša räumt in der  Kultur- und Literaturszene seines Landes auf. Jüngstes Opfer ...,https://www.boersenblatt.net/news/presse-und-kunstfreiheit-slowenien-bedroht-174671
openflows.com,Out Now: HYPER-EMPLOYMENT Book | n.n. -- notes & nodes on ...,"Dec 21, 2020 ... Edited by Domenico Quaranta and Janez Janša, featuring words by ! Mediengruppe Bitnik (Carmen Weisskopf and Domagoj Smoljo) and Felix ...",http://felix.openflows.com/node/590
forum.eu,taz. die tageszeitung | Forum.eu,"Unter Premier Janša ist die Presse- und Kunstfreiheit in Slowenien bedroht. Auch  Renata Zamida, Leiterin der Nationalen Buchagentur, wurde entlassen.",https://forum.eu/de/publisher/taz-die-tageszeitung/42
wbs-law.de,OVG Berlin: Zeigen von Mohammed-Karikaturen während Demo ist ...,27. Nov. 2012 ... ©-Thomas-Jansa-Fotolia. Nach Ansicht ... Nach Ansicht des OVG sind die  Karikaturen unter die Kunstfreiheit des Grundgesetzes einzuordnen.,https://www.wbs-law.de/medienrecht/ovg-berlin-zeigen-von-mohammed-karikaturen-wahrend-demo-ist-rechtens-14185/
forum.eu,Doris Akrap | Forum.eu,"vor 6 Tagen ... Unter Premier Janša ist die Presse- und Kunstfreiheit in Slowenien bedroht. Auch  Renata Zamida, Leiterin der Nationalen Buchagentur, wurde ...",https://forum.eu/de/author/doris-akrap/738
deutschlandfunkkultur.de,Slowenien - Druck auf Kultur und Medien,20. Apr. 2021 ... Zwei Menschen tragen Masken mit Ministerpräsident Janez Janša und dem ...  Regierung unter ihrem Ministerpräsidenten Janez Janša fährt diesen harten ...  Danger Dans Album „Das ist alles von der Kunstfreiheit gedeckt“.,https://www.deutschlandfunkkultur.de/slowenien-druck-auf-kultur-und-medien.1270.de.html?dram:article_id=495972
forum.eu,Warum ich mir den russischen Impfstoff spritzen ließ | Forum.eu,"Unter Premier Janša ist die Presse- und Kunstfreiheit in Slowenien bedroht. Auch  Renata Zamida, Leiterin der Nationalen Buchagentur, wurde entlassen.",https://forum.eu/de/article/warum-ich-mir-den-russischen-impfstoff-spritzen-liess/935
europa.eu,Debates - Government attempts to silence free media in Poland ...,"Mar 10, 2021 ... In Slowenien gab es wiederholt verbale Attacken von Premier Janša ... bei  Einschränkungen der Medien— und Kunstfreiheit ist daher dringend ...",https://www.europarl.europa.eu/doceo/document/CRE-9-2021-03-10-ITM-010_EN.html
feed-reader.net,Renata News: Aktuelle Nachrichten im Ticker (Deutsch),"Unter Premier Jansa ist die Presse- und Kunstfreiheit in Slowenien bedroht. Auch  Renata Zamida, Leiterin der Nationalen Buchagentur, wurde entlassen.",https://news.feed-reader.net/113788-renata.html
scoopnest.com,"They'll be walking among us' Sex robot dad, 60, says cyborgs will ...",... GrenzenDosen HamburgBerliner ArztpraxenPriorisierung Impfverordnung  BundesPremier Janša Presse- KunstfreiheitPolizei Hilfe Sicherheitskräfte  Krawalle ...,https://www.scoopnest.com/de/user/Daily_Star/1030902760164806657-theyll-be-walking-among-us-sex-robot-dad-60-says-cyborgs-will-be-mistaken-for-humans
dw.com,Journalisten in Ungarn droht in Corona-Zeiten Gefängnis | DW ...,4. Mai 2020 ... Sloweniens Premier Janez Janša führt auf Twitter einen verbalen Dauerkrieg  gegen kritische Journalisten. In seinen Augen sind sie Lügner ...,https://www.dw.com/de/journalisten-in-ungarn-droht-in-corona-zeiten-gef%C3%A4ngnis/av-53319116
perlentaucher.de,Archiv Bücher-News - Medienticker - Perlentaucher,boersenblatt.net: Presse- und Kunstfreiheit in Slowenien bedroht. Der  rechtspopulistische slowenische Ministerpräsident Janez Janša räumt in der  Kultur- und ...,https://www.perlentaucher.de/medienticker/sw/buecher-news.html
europa.eu,BIBLIOGRAPHIE COURANTE PARTIE A,Kunstfreiheit im Werkbereich von digitalen Kulturtechniken / Stefan. BBB.208.566 .8. Papastefanou. BBB. ... Internetové právo / Lukáš Jansa ... [et al.] BBB.275.4.,https://curia.europa.eu/jcms/jcms/p1_1884032/fr/
flipboard.com,TOP 10 Sehenswürdigkeiten Slowenien | Urlaubsreise.blog ...,Slowenien als Gastland der Buchmesse: Die neue Achse des Bösen Unter  Premier Janša ist die Presse- und Kunstfreiheit bedroht in Slowenien. Auch  Renata ...,https://flipboard.com/article/top-10-sehensw-rdigkeiten-slowenien-urlaubsreise-blog/a-jJm8GSxfTS-cqFocLmREUA%3Aa%3A2561585694-510c37a897%2Furlaubsreise.blog
politico.eu,Inside Slovenia's war on the media – POLITICO,"Feb 16, 2021 ... Prime Minister Janez Janša's attacks create climate of fear, journalists and  watchdogs say.",https://www.politico.eu/article/slovenia-war-on-media-janez-jansa/
gov.si,War with the media | GOV.SI,"May 11, 2020 ... Prime Minister Janez Janša. You have probably heard many times that a war  against the media cannot be won. This is one of the folk sayings ...",https://www.gov.si/en/news/2020-05-11-war-with-the-media/
euractiv.it,"Slovenia, Janša continua la sua guerra ai media ma ora in ...",29 mar 2021 ... La guerra contro i media del primo ministro sloveno Janez Janša – che da luglio  sarà il presidente di turno dell'Unione Europea – è arrivata ...,https://euractiv.it/section/capitali/news/slovenia-jansa-guerra-stampa-rischio-parlamento/
articolo21.org,Slovenia. La guerra infinita fra Janša e la stampa – Articolo21,"19 feb 2021 ... Janša, protagonista della storia slovena fin dalla nascita della Repubblica nel ...  da Janša, autore di un saggio intitolato “Guerra con i Media”, ...",https://www.articolo21.org/2021/02/la-guerra-infinita-fra-jansa-e-la-stampa/
linkiesta.it,La personale guerra ai mass media del premier sloveno - Linkiesta.it,"24 feb 2021 ... Janez Janša condivide molte posizioni con il suo collega Viktor Orbán, di cui si  proclama estimatore. Da quando è tornato al potere per la sua ...",https://www.linkiesta.it/2021/02/janez-jansa-premier-slovenia-mass-media-giornali/
lacitycollege.edu,Directories - Employee Directory - Los Angeles City College,"Adsit, Robin, Visual & Media Arts, 2513, DH 211, Email Robin. Aguila, Alvaro,  Foster ... Guerra, Juan, Non Credit, 1232, EWD, Email Juan. Guerrero, Carlos,  Social ... Jansa, Pau, Financial Aid, 2021, SSB 156, Email Pau. Janvelyan, David  ...",https://lacitycollege.edu/About/Directories/Employee-Directory
wikipedia.org,Ten-Day War - Wikipedia,"The Ten-Day War (Slovene: desetdnevna vojna), or the Slovenian War of  Independence ... Under Defence Minister Janez Janša, they adopted a strategy  based on an asymmetric warfare approach. ... The Slovenian government and  media successfully presented the conflict to Western European audiences as a  case of a ...",https://en.wikipedia.org/wiki/Ten-Day_War
ilpost.it,Anche in Slovenia si teme per la libertà di stampa - Il Post,"17 feb 2021 ... ... Janez Janša, di estrema destra, è criticato per attaccare media e giornalisti ...  pacifista, fautore della guerra contro la Jugoslavia, poi liberale.",https://www.ilpost.it/2021/02/17/slovenia-janez-jansa-liberta-di-stampa/
linkedin.com,Sarah Paille-Jansa - Senior Business Immigration Analyst ...,"View Sarah Paille-Jansa's profile on LinkedIn, the world's largest professional  community. Sarah has 2 jobs listed on their profile. See the complete profile on ...",https://www.linkedin.com/in/spaillejansa
ansa.it,"Premier Slovenia attacca Politico, 'bugie su libertà stampa' - Europa ...","18 feb 2021 ... ... Janez Jansa ha attaccato su Twitter una giornalista di Politico Europe, autrice  di un reportage intitolato 'La guerra della Slovenia ai media'.",https://www.ansa.it/europa/notizie/rubriche/altrenews/2021/02/18/premier-slovenia-attacca-politico-bugie-su-liberta-stampa_f0a721ea-ea8f-44c8-8088-fe076f54fe26.html
yahoo.com,El lunes se celebro el dia nacional de los veteranos de la guerra de ...,"Mar 29, 2021 ... But Jansa denied that he had sent the document and accused ""fake media"" of  trying to harm Slovenia's efforts to help integrate the Western ...",https://news.yahoo.com/el-lunes-se-celebro-el-041243609.html
theguardian.com,Slovenia's PM Janša channels Orbán with attacks on media and ...,"May 4, 2020 ... Janša, who has a Trump-like tendency to fire off inflammatory tweets and is a  close ally of the far-right Hungarian prime minister, Viktor Orbán, ...",https://www.theguardian.com/world/2020/may/04/janez-jansa-new-pm-slovenia-in-mould-of-orban
euronews.com,Will Janez Janša take Slovenia down the same populist road as ...,"Oct 28, 2020 ... Like Hungary PM Viktor Orban or the Law and Justice party in Poland, voters  seem to respond to his populism out of disappointment with the post ...",https://www.euronews.com/2020/10/28/will-janez-jansa-take-slovenia-down-the-same-populist-road-as-hungary
politico.eu,Orbán walkout shakes up European (political) family drama ...,"Mar 3, 2021 ... Hungarian Prime Minister Viktor Orbán's Fidesz party has left the EPP ... of the  Slovenian Democratic Party of Prime Minister Janez Janša and ...",https://www.politico.eu/article/viktor-orban-hungary-fidesz-leaves-epp-parliament-group/
npr.org,Leaders Of Hungary And Slovenia Say U.S. Election Isn't Over ...,"Nov 7, 2020 ... Orban and President Trump are seen here meeting last year at the White ... Not  Janez Jansa, prime minister of Slovenia, the alpine country in ...",https://www.npr.org/sections/live-updates-2020-election-results/2020/11/07/932581107/leaders-of-hungary-and-slovenia-stout-trump-allies-in-eu-say-u-s-vote-isnt-over
euractiv.com,"Janez Jansa, admirer of Viktor Orban, to be nominated PM of ...","Feb 26, 2020 ... Janša, 61, led the Slovenian government from 2004 to 2008 and from 2012 to  2013. He will have 15 days after being confirmed as prime minister ...",https://www.euractiv.com/section/elections/news/janez-jansa-admirer-of-viktor-orban-to-be-nominated-pm-of-slovenia/
sagepub.com,"Europe's new Orban: Janez Janša, Slovenia's new prime minister, is ...","Dec 14, 2020 ... Good Guy Gone Bad ... IVAN JANŠA, BEST known as Janez Janša, was born in  the town of Grosuplje in central Slovenia, then Yugoslavia, in ...",https://journals.sagepub.com/doi/full/10.1177/0306422020981272
nytimes.com,"Safe in Hungary, Viktor Orban Pushes His Message Across Europe ...","Jun 4, 2018 ... “Jansa is exactly the kind of leader Slovenia needs,” Mr. Orban told Nova24TV.  As they gather strength across Europe, populist parties are ...",https://www.nytimes.com/2018/06/04/world/europe/viktor-orban-media-slovenia.html
total-slovenia-news.com,"Janša, Orbán & Johnson Seen as Europe's Biggest Losers with ...","Nov 8, 2020 ... With the election of Joe Biden as the 46th President of the United States, Politico  looks at the European leaders set to win and lose from the ...",https://www.total-slovenia-news.com/politics/7279-jansa-orban-johnson-seen-as-europe-s-biggest-losers-with-trump-s-defeat
economist.com,Slovenia's prime minister hunts for enemies | The Economist,"Jun 6, 2020 ... Janez Jansa is copying his Hungarian chum, Viktor Orban | Europe.",https://www.economist.com/europe/2020/06/06/slovenias-prime-minister-hunts-for-enemies
total-slovenia-news.com,Janša Pledges to Fight “Cultural Marxism” in Online Discussion with ...,"Jul 9, 2020 ... In short, according to Janša and Orban these seem to be mainly the “progressive  liberal leftists”, as Orban has called the ideological problem ...",https://www.total-slovenia-news.com/politics/6576-jansa-pledges-to-fight-cultural-marxism-in-online-discussion-with-orban-vucic-on-future-of-europe
dw.com,"Prime Minister Janez Jansa, Slovenia′s Marshal Tweeto and the ...","Mar 4, 2021 ... ""The difference between Hungary and Slovenia is that Orban doesn't make  personal attacks on critical journalists,"" Florian Bieber, professor for ...",https://www.dw.com/en/prime-minister-janez-jansa-slovenias-marshal-tweeto-and-the-media/a-56764735
ft.com,Slovenia confirms Orban ally as new PM | Financial Times,"Mar 3, 2020 ... Slovenia confirms Orban ally as new PM ... Slovenia's parliament confirmed  Janez Jansa as its new prime minister on Tuesday, giving a third term ...",https://www.ft.com/content/664897ec-5d6f-11ea-b0ab-339c2307bcd4
dw.com,Orban ally Janez Jansa expected to top Slovenia′s election | News ...,"Jun 2, 2018 ... DW looks at the people vying for power. Viktor Orban meets Janez Jansa in 2012 .",https://www.dw.com/en/orban-ally-janez-jansa-expected-to-top-slovenias-election/a-44055791
foreignpolicy.com,Slovenian Prime Minister Janez Jansa Is a Far-Right Conspiracy ...,"Nov 11, 2020 ... Slovenian Prime Minister Janez Jansa (right) shakes hands with his Hungarian  counterpart, Viktor Orban, prior to their meeting in Ljubljana, ...",https://foreignpolicy.com/2020/11/11/election-2020-trump-biden-slovenia-jansa-lost/
irishtimes.com,Orban ally poised for third stint as Slovenia's premier,"Feb 26, 2020 ... Anti-immigration populist Janez Jansa tapped to lead coalition government.",https://www.irishtimes.com/news/world/europe/orban-ally-poised-for-third-stint-as-slovenia-s-premier-1.4185930
hungarytoday.hu,Another Right-Wing Turnaround in Europe: Orbán Ally Jansa ...,Another Right-Wing Turnaround in Europe: Orbán Ally Jansa Appointed  Slovenia's PM. Péter Cseresnyés 2020.03.10. After Slovenia's liberal PM's failed  attempt ...,https://hungarytoday.hu/another-right-wing-turnaround-in-europe-orban-ally-jansa-appointed-slovenias-pm/
apnews.com,Slovenia right-wing PM Jansa survives no-confidence motion,"Feb 16, 2021 ... Jansa, a nationalist politician with close links to hardline Hungarian Prime  Minister Viktor Orban, has described the opposition attempt as a ...",https://apnews.com/article/europe-viktor-orban-coronavirus-pandemic-slovenia-janez-jansa-eb323e32ff0e696accd0de9e0f1d178d
globalvoices.org,"Slovenian officials rebuff Hungary, refuse to censor cartoon satire ...","Apr 11, 2019 ... Long live the love between Orbán and Janša!” the editorial quipped. The new  caricature shows Orbán holding an olive branch (symbol of ...",https://globalvoices.org/2019/04/11/slovenian-officials-rebuff-hungary-refuse-to-censor-cartoon-satire-ridiculing-viktor-orban/
balkaninsight.com,New Slovenian Government Raises Fears of 'Orbanisation' | Balkan ...,"Mar 17, 2020 ... Hungarian Prime Minister Viktor Orban and leader of the Slovenian Democratic  Party, SDS, Janez Jansa attend a campaign event of SDS in ...",https://balkaninsight.com/2020/03/17/new-slovenian-government-raises-fears-of-orbanisation/
eurotopics.net,Farewell EPP: will Orbán find new partners? | eurotopics.net,"Apr 1, 2021 ... “Not even Slovenian Prime Minister Janez Janša and his party, who sympathise  with Orbán, want to join. They, too, want to be close to the ...",https://www.eurotopics.net/en/257326/farewell-epp-will-orban-find-new-partners
balkaninsight.com,"Slovenia Seen Emulating Hungary, Poland with Media Reforms ...","Jul 22, 2020 ... Slovenia's right-wing prime minister, Janez Jansa, is taking a leaf out of Viktor  Orban's book with changes to the way public service media are ...",https://balkaninsight.com/2020/07/22/slovenia-seen-emulating-hungary-poland-with-media-reforms/
reuters.com,Slovenia president names center-right Janez Jansa as PM ...,"Feb 26, 2020 ... FILE PHOTO: Janez Jansa, leader of the Slovenian Democratic Party (SDS), ...  He is close to Hungarian Prime Minister Viktor Orban and has ...",https://www.reuters.com/article/us-slovenia-government/slovenia-president-names-center-right-janez-jansa-as-pm-candidate-idUSKCN20K20B
theglobepost.com,Europe's East-West Divide: Tolerance With Authoritarian ...,"Jul 14, 2020 ... Hungary's Viktor Orbán sees Europe divided not only by political values but ...  Janša and Orbán both stressed that today's European politics ...",https://theglobepost.com/2020/07/13/europe-east-west-divide/
rmx.news,Slovenia's PM Janša under fire for being PM Orbán's 'hardline anti ...,"May 6, 2020 ... Politico also wrote that Janša is an ""anti-immigration hardliner and ally of  Hungarian PM Viktor Orbán"" and referred to him as a ""strongman"", a ...",https://rmx.news/article/article/slovenian-pm-jansa-under-fire-for-being-pm-orban-s-hardline-anti-immigration-ally
editorandpublisher.com,Slovenia's PM Janša Channels Orbán With Attacks on Media and ...,"May 5, 2020 ... Janša, who has a Trump-like tendency to fire off inflammatory tweets and is a  close ally of the far-right Hungarian prime minister, Viktor Orbán, ...","https://www.editorandpublisher.com/stories/slovenias-pm-jana-channels-orbn-with-attacks-on-media-and-migrants,84227?"
journalofdemocracy.org,Explaining Eastern Europe: Orbán's Laboratory of Illiberalism ...,"Viktor Orbán's Fidesz party has used its two-thirds majority in parliament to ... In  early June 2018, Orbán and his state-run media gave Janša a huge boost in ...",https://www.journalofdemocracy.org/articles/explaining-eastern-europe-orbans-laboratory-of-illiberalism/
mironline.ca,The Return of Janša: Can Illiberal Democracy Triumph in Slovenia ...,"Nov 17, 2020 ... On March 13, 2020, Janez Janša was sworn in for his third term as prime minister  of Slovenia, despite his 2013 conviction for bribery. Janša ...",https://www.mironline.ca/the-return-of-jansa-can-illiberal-democracy-triumph-in-slovenia/
occrp.org,Oiling Orbán's Propaganda Machine - OCCRP,"Feb 28, 2020 ... An ally of Viktor Orbán is suspected of greasing the Hungarian Prime ... Janša in  Slovenia — who are considered friendly to Orbán. Both men ...",https://www.occrp.org/en/investigations/oiling-orbans-propaganda-machine
intellinews.com,DeSUS party leaves Slovenian government in ... - bne IntelliNews,"Dec 17, 2020 ... DeSUS party leaves Slovenian government in blow to PM Jansa ... referring to  autocratic Hungarian PM Viktor Orban, a close ally of Jansa.",https://www.intellinews.com/desus-party-leaves-slovenian-government-in-blow-to-pm-jansa-199213/
ips-journal.eu,The Orbanisation of Slovenia – Democracy and society | IPS Journal,"Apr 19, 2021 ... Slovenia's Prime Minister Janez Janša has learned from Orbán's and Trump's  playbook how to slowly dismantles the free press and rule of law.",https://www.ips-journal.eu/topics/democracy-and-society/slovenias-orbanisation-5123/
wsj.com,"Befriended by Trump, Populists in Europe's East Brace for Change ...","Nov 23, 2020 ... President Trump with Viktor Orban, Hungary's nationalist prime ... Jansa became  the first—and only—world leader to publicly declare that ...",https://www.wsj.com/articles/befriendedby-trump-populists-in-europes-east-brace-for-change-11606156894
eurozine.com,Axis of illiberalism | Eurozine,"Jul 9, 2018 ... By a coincidence of electoral timetabling, Viktor Orbán (Fidesz) in Hungary and  Janez Janša (SDS) in neighbouring Slovenia recently won ...",https://www.eurozine.com/axis-of-illiberalism/
jacobinmag.com,"Against Janša, Against Brussels","Jun 15, 2018 ... The far right won elections this month in Slovenia. Can the Left mount a  challenge? Janes Janša with Viktor Orbán at the European People's ...",https://jacobinmag.com/2018/06/slovenia-miro-cerar-levica-sds-orban
wikipedia.org,Janez Janša - Wikipedia,Ivan Janša baptized and best known as Janez Janša is a Slovenian politician  who is currently ... and proceeded to tweet a series of conspiracy theories about  the election. Janša is a close ally of Hungary's prime minister Viktor Orbán.,https://en.wikipedia.org/wiki/Janez_Jan%C5%A1a
bloomberg.com,Europe in Line for Another Nationalist Leader as Jansa Gets Nod ...,"Feb 26, 2020 ... Slovenian opposition leader Janez Jansa won a chance to form a new  government, birthing a new nationalist administration in a region already ...",https://www.bloomberg.com/news/articles/2020-02-26/orban-s-nationalist-ally-in-slovenia-wins-bid-to-form-government
go.com,"Slovenia's new government sworn in, pledges to fight virus - ABC ...","Mar 13, 2020 ... ... Minister Janez Jansa, leader of the anti-immigrant Slovenian Democratic Party  and an ally of Hungary's hardline Prime Minister Viktor Orban.",https://abcnews.go.com/International/wireStory/slovenias-government-sworn-pledges-fight-virus-69589573
bbc.com,Deep concern' over coronavirus emergency powers - BBC News,"Apr 2, 2020 ... Hungary's Prime Minister Viktor Orban took sweeping new powers to fight ...  Recently installed right-wing Prime Minister Janez Jansa wanted to ...",https://www.bbc.com/news/world-europe-52135402
express.co.uk,Slovenia election: Janez Jansa uses tips EU nemesis Orban ahead ...,"Jun 1, 2018 ... SLOVENIA'S general election front-runner Janez Jansa is getting tips from  Hungarian prime minister Viktor Orban's political playbook to scoop ...",https://www.express.co.uk/news/uk/967977/slovenia-election-Janez-Jansa-Viktor-Orban-slovenia-general-election-Hungary-prime-ministe
ipi.media,"New Administration, Old Agenda: Press Freedom Strained Again in ...","Sep 1, 2020 ... Slovenia's Prime Minister Janez Jansa arrives speaks to the media ... Hungarian  Prime Minister Viktor Orban (C), Slovenian Prime Minister and ...",https://ipi.media/new-administration-old-agenda-press-freedom-strained-again-in-slovenia-under-veteran-pm-jansa/
independent.co.uk,Slovenia's PM apparently becomes first leader to back baseless ...,"Nov 4, 2020 ... Slovenian prime minister Janez Janša appears to have become the first ... in  March 2020 and has close ties with Hungary's PM Viktor Orban.",https://www.independent.co.uk/news/world/europe/trump-election-win-slovenia-janez-jansa-b1586241.html
lrb.co.uk,Matthew Porges | In Ljubljana · LRB 7 April 2020,"Apr 7, 2020 ... The SDS is a nationalist, anti-immigrant party of a familiar type; Janša is a close  friend and ally of the Hungarian prime minister, Viktor Orban.",https://www.lrb.co.uk/blog/2020/april/in-ljubljana
france24.com,Slovenian media fear fallout from government virus campaign ...,"Apr 19, 2020 ... Jansa has been a prominent Orban ally and deploys similarly strident anti- immigrant rhetoric. Cirman told AFP about the backlash to ...",https://www.france24.com/en/20200419-slovenian-media-fear-fallout-from-government-virus-campaign
bbc.co.uk,Slovenia election: Anti-immigrant SDS is largest party - BBC News,"Jun 3, 2018 ... Janez Jansa of the SDS party talks to the media after his party won elections. ...  Jansa is a supporter of Hungary's nationalist PM Viktor Orban.",https://www.bbc.co.uk/news/world-europe-44349007
aljazeera.com,Slovenia: Anti-migrant party gains highlight 'Orban's soft power ...,"Jun 4, 2018 ... Like many analysts, Kreko said Orban's open endorsement of the 59-year-old  Jansa and his party were part of a broader transnational process ...",https://www.aljazeera.com/news/2018/6/4/slovenia-anti-migrant-party-gains-highlight-orbans-soft-power
gov.si,Prime Minister Janez Janša meets with Hungarian Prime Minister ...,2 sep 2020 ... Prime Minister Janez Janša today in Bled met with the Hungarian Prime Minister  Viktor Orbán. The prime ministers discussed the relations ...,https://www.gov.si/en/news/2020-09-01-prime-minister-janez-jansa-meets-with-hungarian-prime-minister-viktor-orban/
journalismfund.eu,How Viktor Orbán is exporting his illiberalism | Journalismfund,"Mar 22, 2018 ... ... the Hungarian prime minister Viktor Orbán were buying up media outlets ...  owned by the Slovenian far-right party SDS, led by Janez Janša.",https://www.journalismfund.eu/supported-projects/how-viktor-orban-exporting-his-illiberalism
youtube.com,"[Prispevek Slovenija] 14.05.2018 Nova24TV: Orban:""Janša je tisti ...","15 maj 2018 ... [Prispevek Slovenija] 14.05.2018 Nova24TV: Orban:""Janša je tisti voditelj ki ga  Slovenija potrebuje""",https://www.youtube.com/watch?v=2Pbe7AxLNT8
hungarianspectrum.org,Viktor Orbán's old Slovenian friend Janez Janša is back: The ...,"Feb 29, 2020 ... In the last two years, I have written several articles on Slovenian-Hungarian  relations, one of which was about Viktor Orbán's efforts to influence ...",https://hungarianspectrum.org/2020/02/29/viktor-orbans-old-slovenian-friend-janez-jansa-is-back-the-question-is-for-how-long/
yahoo.com,Slovenia anti-migrant party leader nominated as PM,"Feb 26, 2020 ... Janez Jansa's Slovenian Democratic Party (SDS) announced on ... and ally of  Hungarian nationalist Prime Minister Viktor Orban, Jansa led two ...",https://www.yahoo.com/now/slovenia-anti-migrant-party-leader-nominated-pm-152544424.html
euobserver.com,EPP group moves forward to suspend Orban's Fidesz,"Mar 2, 2021 ... Viktor Orban speaking at an EPP party congress in 2018 in Helsinki - the ...  Slovenian MEPs from prime minister Janez Jansa's party, who ...",https://euobserver.com/political/151089
brusselstimes.com,Slovenian PM congratulates Donald Trump for winning election,"Nov 4, 2020 ... The Prime Minister of Slovenia Janez Jansa congratulated Donald Trump ...  Jansa, a close associate of Hungarian Prime Minister Viktor Orban, ...",https://www.brusselstimes.com/news/world-all-news/139137/slovenian-pm-congratulates-donald-trump-for-winning-election-janez-jansa-viktor-orban-electoral-system/
gpb.org,"Leaders Of Hungary And Slovenia, Stout Trump Allies In EU, Say ...","Nov 7, 2020 ... Hungarian Prime Minister Viktor Orban did not join other European leaders in ...  Jansa even cheered Trump on when the president prematurely ...",https://www.gpb.org/news/live-updates-2020-election-results/2020/11/07/leaders-of-hungary-and-slovenia-stout-trump
